id,return_id,issue_date,resolve_date,complaint
8b38dec0-963b-4e8d-9ae4-bd6551bb6050,0c2337de-e7e4-47f6-aab5-c22fc7d2531b,2024-09-22 00:00:00,2024-09-26 00:00:00,Zmarły zdolny podnieść łąka kościół obiekt paliwo.
e206d851-953f-44c6-9bfa-38f589e1753e,ebbc6c97-f5a3-4dd4-9538-a56d8e680b58,2024-08-30 00:00:00,2024-09-08 00:00:00,Wzór połączenie 3 sen.
f9282136-204a-4a66-82be-46ba7d9a3072,b435090c-4e4e-4a2a-9449-53f7d0ca4457,2023-04-20 00:00:00,2023-04-28 00:00:00,Pragnienie naturalny słodki pojawiać się.
4e462c87-1e31-4c37-9b34-69ac2b01c6a2,ba08ced5-e0e9-44e1-b566-5b71548377ec,2023-07-31 00:00:00,2023-08-05 00:00:00,Miejsce telefon określony 1 działanie Dania.
2ce30de6-053e-400d-92c5-5e6fea400c35,2f40fc54-f856-4069-957d-481bbc936c72,2023-11-08 00:00:00,2023-11-17 00:00:00,Mecz raz mąż komórka 8.
fa246274-fe75-400a-96bf-0a14b385623a,3e857858-2a07-4a73-9a8b-ab8a2f493649,2023-10-04 00:00:00,2023-10-07 00:00:00,Słowo sprawa 5.
c6fa544f-b7f0-44bf-84aa-2871daafad5d,55cd00af-2c3f-4939-a48a-a8fc7fb58c8c,2024-03-28 00:00:00,2024-04-04 00:00:00,Ulegać większy obóz lista odpowiedni koncert.
5edb08fb-be48-4126-bf11-97b63299ebdc,fd7d9b9a-4366-41f1-aa6c-7cf70a3fdf49,2024-10-02 00:00:00,2024-10-06 00:00:00,Wojskowy wzór sklep kawałek górski ich miara według.
9d409746-8caf-4abe-9d8f-79b149b4ba22,6d22e013-7bbb-4961-a683-30b143de4546,2023-07-08 00:00:00,2023-07-15 00:00:00,Port hiszpański Bóg łąka.
9b6c65c6-5ee3-4c77-9029-24c46512ed63,30db0a43-1a9d-492d-bafc-9a51e1d22fd8,2023-01-25 00:00:00,2023-01-26 00:00:00,Moneta intensywny opuścić.
167f48c4-80bf-4f78-a5fe-f7ec89b4891a,ba490d70-98dc-4b35-be0c-42da300d5014,2023-03-07 00:00:00,2023-03-14 00:00:00,Akcja literatura filmowy.
91ffd98a-30b2-470d-9a4f-eb68f13c9c61,bcaeb73f-8243-4091-bc2b-028c57f7fd6a,2023-05-20 00:00:00,2023-05-27 00:00:00,Stworzyć płacić roślina przeszłość zamiar.
c6d18825-c380-43bb-95f8-eb529d027737,181a9292-10d0-4712-a16c-00c4c8b8bb55,2023-11-02 00:00:00,2023-11-11 00:00:00,Święto morze umrzeć zacząć most młody.
4abb8cb4-2356-4dc9-b3fe-b240fcdf783b,f8ebd5ae-0366-43c8-9355-548989a64386,2024-03-16 00:00:00,2024-03-26 00:00:00,Seksualny przejście jednostka dzień wina ty but.
e38646a4-730a-46ab-a7a1-c28394d0742f,9c82dc95-07a1-4ea5-8807-40039339cd7c,2024-07-20 00:00:00,2024-07-24 00:00:00,Trzydzieści zasada wiele uderzać dolina leżeć.
8bf44755-3277-4ae8-bc76-24aacbfaac17,008043a3-3772-482e-ae33-bdf5974eeae6,2023-10-15 00:00:00,2023-10-23 00:00:00,Rodowity ono wcześnie ślad przyjaźń otaczać ogromny.
8632d48b-2a60-4713-9973-96473e75ed5e,da06ee13-63c4-4456-8cbd-caa37e2f8e2a,2024-11-20 00:00:00,2024-11-29 00:00:00,Ciecz wstyd rządzić mistrz wykonanie typowy.
e47ee74e-778d-4f31-a2c8-999ad950fc3f,2a643108-5bb9-4c8b-9f9e-5c15e7862695,2023-07-21 00:00:00,2023-07-25 00:00:00,Sprawa Żyd plac zwykły obok dodatek zdarzenie.
c4f3289e-3fa9-4078-aa40-ebcde6943827,dede97e2-2301-4380-9b6e-60f0499aa1eb,2023-12-24 00:00:00,2023-12-31 00:00:00,Dzielnica alfabet bo być kłaść.
9df1265e-592a-4276-9796-d83d31b736a0,896c23b7-2307-4c24-b086-61523c8ad412,2023-05-12 00:00:00,2023-05-18 00:00:00,Możliwość górny stać się zysk bóg literacki kościelny.
72d0936e-e41e-4bea-9df8-683e981e1955,1154d0e8-23b5-4674-af8f-b7853d3ca26f,2023-06-07 00:00:00,2023-06-17 00:00:00,M.In. projekt ale włożyć spowodować.
e6dc064c-2cb1-458b-8a98-fb44228f1f5c,a29808d0-2c5f-4eef-a110-843a4f7a04eb,2024-06-30 00:00:00,2024-07-10 00:00:00,Terytorium mieszkać czerwony wysiłek.
31cd4946-63b0-49db-8790-acadec5723ad,8fe112cb-39ef-46c2-b33a-d3b184a42fe8,2024-07-03 00:00:00,2024-07-07 00:00:00,Tłum wygląd trwały przedstawiać strata.
051941c4-8559-447c-9878-b6b7f6aea223,a4cda7ea-941d-45c0-b3ac-4cd8035dc899,2023-07-31 00:00:00,2023-08-09 00:00:00,Twardy zając dotyczyć cierpienie miasto.
027e1eba-17fe-450d-96c3-2e64c1a180e6,c0718fad-0daa-4d9a-a3fa-881db2be3b2b,2023-05-19 00:00:00,2023-05-20 00:00:00,Klub zakończenie powietrze stolica radio.
15fdc3fe-57bb-499a-b870-65c69a7608ee,34140bff-88e4-4fcb-9124-cdf1aafe2013,2024-03-15 00:00:00,2024-03-17 00:00:00,Wykonywać szef ciężar staw szczyt zewnętrzny.
a67ee1b1-f02a-41c3-b5f8-0b05c18ab183,cb16ac50-60fb-4fb0-a79c-6fe8624200e4,2024-12-07 00:00:00,2024-12-11 00:00:00,Sklep trudno za postawa komórka dziesięć atmosfera.
a8835294-7981-4711-839e-5255bcbcff65,1353db1f-bac7-4115-b1cf-ce138c8560ef,2023-01-31 00:00:00,2023-02-08 00:00:00,Jezioro królewski powolny głupek.
691a8d1d-fa26-4640-9f39-b3e142721194,40e17e34-38ae-48db-a91e-6400e000a764,2023-03-18 00:00:00,2023-03-21 00:00:00,Polak liczyć ale 70 tłumaczyć partia.
078eb625-eca1-4bd6-a47c-3af2a06d9994,066d3f46-1c19-4df8-8354-39ad91e2d368,2024-01-26 00:00:00,2024-01-29 00:00:00,Zawód pracownik postać lina.
fd3c8d9c-132a-43bb-bd3e-935d60c78f74,8c56bb87-3b6f-415f-8d78-14bfe0a7602c,2023-12-23 00:00:00,2023-12-27 00:00:00,Nieprzyjemny widok wy obiekt porządek związany.
ca8cff71-228b-440c-81f2-188c630fad4d,d5211f06-b7d3-410b-b4a5-64a4394d4809,2024-07-31 00:00:00,2024-08-05 00:00:00,Cukier biały wprowadzać prąd.
095de210-d6ed-4f4e-be29-0cd5a34d8d66,532298d8-8bd4-4431-8676-aa5f378a1232,2024-03-09 00:00:00,2024-03-15 00:00:00,Wiek sobą w. ciemny kartka cel.
063916ff-8c32-464d-abbb-1359af00a5e9,5b2c26a8-0fab-4ec8-a99a-0f8c8df9d7a8,2024-08-24 00:00:00,2024-08-26 00:00:00,Zostać nie bądź odzież.
4c72cd1e-3fca-4f18-9cb4-0a005079a08b,92d09ad2-2d2e-453d-b7ae-c56972b10b0c,2023-11-22 00:00:00,2023-11-30 00:00:00,Powinien piłka nożna trzeci wydawać się sztuczny las autobus.
975c4d54-625c-41e5-92a6-396a1c18059f,8dd2ca62-068f-49f2-b670-32f13e8d662c,2024-06-27 00:00:00,2024-06-29 00:00:00,70 obchodzić dolny za jasny.
798fd0cf-cd77-4c67-a698-7bb5ffc7912e,c8f1d548-59d3-41a3-a78b-4b5d76d7bd83,2023-12-08 00:00:00,2023-12-10 00:00:00,Wobec niszczyć prezydent rok podczas środowisko bezpieczeństwo.
d4514ef4-86fd-4f78-b72e-c0db06e3f8e6,6d260463-1b9c-40ce-a35b-6df6e5286239,2023-03-09 00:00:00,2023-03-17 00:00:00,Rower jezioro uczeń aby rodowity ryzyko.
4a505e62-f0d0-4c41-9590-778d9ac09264,7bb993c1-d56d-4850-ae14-e9918c2a1175,2024-03-04 00:00:00,2024-03-14 00:00:00,Przechodzić nasiono październik następny.
db61b36f-feb5-4550-aecb-25a39989098c,aacf9e9b-ecc3-41ed-b784-0592f81c50bf,2024-09-10 00:00:00,2024-09-13 00:00:00,Oni żaden tworzyć psychiczny jasny.
ac8a843a-eaee-4c5f-9925-219de0abbc5e,80668e21-0a18-46cf-956e-57dd82b81727,2023-09-26 00:00:00,2023-10-06 00:00:00,Białoruski zawsze średni padać sprzedaż.
0034a380-493d-4332-8cd6-982637ef9223,91a71993-01ea-4b16-b1a2-19ce0388fe40,2023-04-04 00:00:00,2023-04-05 00:00:00,Podstawa dawny dokładny podstawa Węgry.
0d20adde-b20b-456a-9222-157f98d16e1c,dd452a3d-d843-4bc5-b753-f4340d22e8e4,2023-12-05 00:00:00,2023-12-10 00:00:00,Pomarańczowy postępowanie zimny wisieć graniczyć temperatura konstrukcja amharski.
a4e9f1e6-83de-476d-87c8-4dc1cc49ca4e,60f82c92-3bec-4ea7-8b3f-ba786bd2716e,2023-03-08 00:00:00,2023-03-09 00:00:00,Wszystek zazwyczaj głowa księga autor.
d64f935b-9e07-4189-b95d-3b7af72c3cfa,47485989-1d5b-47dd-8231-70a0bcd43f8d,2023-09-14 00:00:00,2023-09-21 00:00:00,Zdrowy telefon złodziej.
af140e14-0db8-439e-adf8-8e1169fc36cb,990bdf53-b065-4150-8f9e-aa4f2eca1254,2024-10-26 00:00:00,2024-11-05 00:00:00,Miara przez ciepło.
a1032abd-6ac5-4157-9a25-d953bf090e8e,1329fa69-6735-4037-9195-35be60808970,2024-09-01 00:00:00,2024-09-05 00:00:00,Wyłącznie sam wchodzić azjatycki pływać.
ca2cdf0b-8c35-42a2-a8a8-29b4e9acf78b,93e5657d-0dac-4a5a-83d1-764607a9b57b,2023-12-13 00:00:00,2023-12-20 00:00:00,Czyli zachodni ciągnąć uderzać budzić.
91273dbe-f8d8-4259-a353-313685abf946,e6a1162a-5226-4714-84d8-fec8dfcc669f,2024-08-30 00:00:00,2024-09-02 00:00:00,Dusza jesień oczywiście otwór morski lampa.
44451d46-3495-4c5c-bfb9-761508e3049f,139b4c7b-0d97-4b80-998b-6fa28eaa5b2e,2024-04-11 00:00:00,2024-04-19 00:00:00,Ludność skala kontakt kolumna forma rzeka temat.
1f79a31a-c4fe-457e-88a4-c137d00c1e46,e19baa75-8b18-4f45-bfe7-4b813bd53c5a,2023-01-27 00:00:00,2023-01-29 00:00:00,Dużo nasienie wyłącznie siedziba łąka symbol poniedziałek zapalenie.
a89a848b-ec82-4e98-96f0-d58776691b5b,2c57a1b4-08b6-4368-b818-fe936e2f3372,2023-04-04 00:00:00,2023-04-10 00:00:00,Blady mapa toponim waga tydzień przechodzić.
de4f4026-7d03-4af2-b4e9-62f3cf1e5cae,c11444c8-c48e-4ce7-9282-74e7405b9b66,2024-04-29 00:00:00,2024-05-02 00:00:00,Poprzedni rezultat drewniany mur oznaczać chłop drapieżny.
e8271c83-a612-49a5-a23e-c83a4d2d716b,4e642ab7-5942-4c54-bf63-0e8c3c3ff9ce,2024-07-16 00:00:00,2024-07-19 00:00:00,Interes wąski dar tajemnica skóra tarcza.
4e4f6421-c791-43fb-a44f-ebf84325bfc8,686ae57e-5ef3-4682-8828-226d8e1d460c,2023-04-26 00:00:00,2023-04-27 00:00:00,Patrzeć droga grób październik wpływ rodzic sport.
b21bd9ee-3a38-4bc5-90d1-0f63461cca43,9674f246-ae37-4c5d-b81f-63555e16e9c4,2023-03-23 00:00:00,2023-03-27 00:00:00,Wielka Brytania uznawać symbol zgadzać się zapach całość niedziela.
151bf2d4-1386-4813-95cd-e4c6b04355f4,5e05629f-cfca-4cdf-8048-b64c1476b4c8,2023-03-03 00:00:00,2023-03-10 00:00:00,Dziura wykonanie mama pojawić się.
aa5f2ece-eecf-46e7-b4e2-062a4cec27cd,b245e6ed-cd77-4634-93a5-25ef4102f1fe,2023-05-27 00:00:00,2023-06-06 00:00:00,Odpowiadać zajmować się podłoga ptak włożyć.
72349948-23c0-4d0a-aed7-ac608077de1e,ecf1b915-5323-40b9-b61f-35dda2303cb5,2023-09-03 00:00:00,2023-09-05 00:00:00,Trawa zmienić przestępstwo.
661d9c96-6ece-4dca-87d4-05ac02dfd7b5,d433c15d-f949-4261-91a1-8cfb4a25c093,2024-08-22 00:00:00,2024-08-30 00:00:00,Figura alkohol archipelag czekolada częściowo grać Warszawa herbata.
1a46ee76-daec-415b-81ca-4b4673fde4dc,488790df-6275-4634-999c-26ce43e73503,2024-12-10 00:00:00,2024-12-11 00:00:00,Urodzić lęk wakacje kontakt toponim czysty mąka.
7ab29019-7d5b-4adc-9238-bfeb105e59b0,253e917d-e28d-4e34-8a7d-e44335c40788,2023-03-23 00:00:00,2023-03-24 00:00:00,Kontynent możliwy żywy aby powinien poruszać się liść próba.
4ef86aaf-08ac-49f6-a594-c9e40de0b9de,f0c72472-af89-4913-8578-54b52b60c9d1,2023-02-03 00:00:00,2023-02-04 00:00:00,Trudny narodowy ulica uciec już umieścić.
c9086f70-24af-4de5-9835-4b6d66c1b4cb,6dd9c4a6-6201-4927-b1e0-237f2bb270c9,2023-08-23 00:00:00,2023-08-26 00:00:00,Przedmiot ból rana życie suchy ponownie ósmy.
016b0bc4-d0f2-461a-a452-33507e525087,c7acc602-cbd2-44af-9264-f9d6e9ee3c11,2024-02-11 00:00:00,2024-02-19 00:00:00,Przyprawa wniosek zmienić kanał własny upadek świeży.
6b52974b-c3f5-48a1-bef1-a266ff3ab137,7fdd7f64-80ec-43c1-b7f2-8d6cd402376a,2024-05-04 00:00:00,2024-05-08 00:00:00,Bezpieczeństwo Warszawa kwestia model świadczyć.
5bba6857-a501-4506-a14a-b63db75b5769,71c36084-7f65-471c-9bd4-5903e9b32663,2024-03-12 00:00:00,2024-03-21 00:00:00,Sprzęt dyrektor zwolennik.
aff71597-bac4-4533-8f30-fb1fb450fae3,2591c9a9-aace-4c5d-a667-e5f58eba282c,2024-06-28 00:00:00,2024-06-30 00:00:00,Znajdować 100 mózg dziedzina pełnić jakiś dostać.
8a2c71a8-7be8-4a81-8733-27fc9232bac2,634be5a4-598f-48b1-b598-66e20b3a99b5,2024-03-17 00:00:00,2024-03-19 00:00:00,Tajemnica francuski czyjś Litwa szwedzki 1 szkoda.
547e9c3c-51de-4a51-8cfe-95d12eeac3bc,cfedb597-e356-4c6e-9f3c-0d821f0e6234,2024-05-22 00:00:00,2024-05-30 00:00:00,Żelazo czyli obiad chory.
f0d1ffe0-72ad-4b99-9740-74ea64b81af0,5c70a2a2-c1e1-43c2-afbe-8b9550eaf772,2024-06-29 00:00:00,2024-07-04 00:00:00,Mówić wreszcie istota północny -.
7dacec14-c524-4a87-a44c-6ac605925386,a5b11e6f-deab-42c4-babf-1619058f92ff,2024-03-30 00:00:00,2024-04-05 00:00:00,Bogini zapach spadek teraz udać się oni lubić piąty.
f8d74a31-0781-486f-bc0e-efd454861121,9a7e579c-09f9-4feb-9474-415c2aedc5df,2024-01-22 00:00:00,2024-01-26 00:00:00,Przyjaźń sos zniszczyć należeć minister.
e351de04-7618-4626-9c0b-8b858ed3f279,2cc70a62-130e-47f2-a589-2212be444369,2023-03-08 00:00:00,2023-03-15 00:00:00,Panna składać wkrótce poruszać się część przynieść.
350b3190-3d7c-4f2b-8327-dfd6f861e11f,0ff77c1f-39a8-4d7b-856e-91f3e483b0f8,2024-01-31 00:00:00,2024-02-07 00:00:00,Mózg dolina funkcja opłata tutaj transport zobaczyć.
c50178d4-7c35-437e-9835-cd9d7d7d602a,e58a5f56-0990-40b0-a439-44f1a9e88bed,2023-05-19 00:00:00,2023-05-25 00:00:00,Kochać paliwo dobry skala.
b5a41855-a0f2-4274-84d9-0b416234451e,78f934cf-87d7-4699-b856-cbf2c3bb68d1,2024-08-15 00:00:00,2024-08-17 00:00:00,Ramię pracownik wiosna czasem handlowy dziewięć który.
6c6bde7b-eb4b-4c64-83ef-388b75882a64,3f538b28-c4b1-4be1-9a84-bd7507f3ed61,2024-04-01 00:00:00,2024-04-11 00:00:00,Żołnierz tańczyć substancja pokonać gwiazdozbiór plan odbywać się dół.
7f860f09-d5a8-4bc5-8b19-579aa7c22821,8b1d548b-22b3-4f4e-ae65-aa7ee9a31517,2023-11-21 00:00:00,2023-11-29 00:00:00,Siedemdziesiąt waluta aż restauracja.
4ddd2654-8034-4709-946c-0e5833c66767,cac1809d-a010-4303-835d-b7c086ff72f2,2023-04-15 00:00:00,2023-04-17 00:00:00,Dodatkowy podobny ciasto myśl kąt.
7d257c0b-ed45-48a0-b34e-abedbf686096,2c3c5c39-d7b3-4dd4-851b-ac9e21253cae,2023-04-20 00:00:00,2023-04-23 00:00:00,Rumunia okropny mleko choroba wysłać sześć komórka.
c6cc06df-4ef4-439c-9470-0efa77450dcd,96d15d98-0a87-47f5-986e-0169f00e641c,2024-10-14 00:00:00,2024-10-24 00:00:00,Problem pociąg ogród wydać.
4d2426d3-3565-434c-9a9f-72eed90ceeec,6529530c-a123-4582-9b4a-e800e19581a0,2024-10-28 00:00:00,2024-11-04 00:00:00,Pole przeciwko olej model kino pokazywać mieszkać.
75f7dcec-20e6-41c0-ad50-f926862d9529,90aadf56-c69c-49ea-9796-8d433de5454b,2024-06-16 00:00:00,2024-06-26 00:00:00,Badanie opowiadać zbiór oś pająk wyspa obok.
31bf3137-02ed-4e41-9b88-e96d952309cc,e0d5b8e5-98f6-437e-a471-9575fed11136,2023-04-10 00:00:00,2023-04-13 00:00:00,Zgodnie lek punkt rzucać gniazdo gra.
1fe63217-7da6-4004-a9bd-c23410a6e0f5,99599848-22e1-4e79-8bb7-f7a166b28c66,2023-07-01 00:00:00,2023-07-02 00:00:00,Sam kosztować sierpień słaby styl układ okresowy smak pozostać.
13dc8398-d121-4bda-8bcf-b26afe156dbc,2eecabaf-0097-4918-84a1-7813428baf69,2024-09-24 00:00:00,2024-09-30 00:00:00,Trudny ten sam urzędnik ogromny.
d48230f0-2018-4e4a-ae56-376c1f951edc,5727818c-754f-42c0-947e-f1bfa78e6ceb,2023-01-11 00:00:00,2023-01-14 00:00:00,Jeździć piec ciepły próba plan.
b449ab62-18a9-4962-88c0-ca68e2306926,70cace35-8181-4694-b0ac-8d209e218703,2024-03-06 00:00:00,2024-03-08 00:00:00,Itp. ciepły szkolny występować tłum lis właściciel.
cb25264d-5690-4891-af8c-6ea2734a34a1,0115fa6a-9940-4468-bbd8-1ad1a32b2f48,2023-04-28 00:00:00,2023-04-30 00:00:00,Własny dzielić płyta uciekać.
9e470a7c-01fa-4a7c-a3fc-e5cb7d784079,0f998b1d-4220-4636-b4fe-31d74dc6c2f6,2024-12-14 00:00:00,2024-12-20 00:00:00,Bajka bajka związać ziemia istnienie.
e42e0bc6-1777-4b61-b206-be8fc8f42e73,d541015c-10d7-4891-987f-a3a2543d231d,2024-02-28 00:00:00,2024-03-09 00:00:00,Czterdzieści ukraiński sklep jechać jeśli.
2b3c9124-c269-4e3f-b0a7-aae1d8cd2863,b46c4f97-dd0e-4e34-9560-c66e769b9403,2024-02-21 00:00:00,2024-02-26 00:00:00,Jednostka sześćdziesiąt tor jądro kontynent grupa.
62b41fab-076c-4239-bd7b-914783ae24fd,57201169-0993-4733-87a0-a72189352680,2023-07-26 00:00:00,2023-08-03 00:00:00,Azja styczeń słuchać częściowo.
705039a7-c0b9-4d1d-9b11-13430057f13e,ea14e5fc-30ff-4b84-9dd8-64deeafe07d0,2024-09-22 00:00:00,2024-09-28 00:00:00,Ciotka pokarm określenie charakter osioł wywodzić się.
2e7c4982-39a0-4324-b5c2-c2798e9dc05a,af41b22a-2b47-456b-beb4-1cbc2f883e40,2023-11-08 00:00:00,2023-11-11 00:00:00,60 bank zimny.
75a61b7b-4e0e-4ee7-8579-a14784d62d33,f224ee82-fbc7-4530-a32e-60b961a08be9,2023-12-16 00:00:00,2023-12-23 00:00:00,Zanim stary 1000 ze zawodowy region przecież kwiecień.
7748bdc9-fa35-452a-a221-31855be2142b,09700cd8-538b-41c9-b0ca-b17f4d952104,2024-11-08 00:00:00,2024-11-15 00:00:00,Panna marka mapa one.
390920c5-de2c-4740-8f78-888d4142553d,29bc2d34-716c-496e-bc6a-532de6f17609,2024-07-24 00:00:00,2024-07-30 00:00:00,Rzadki nazwa drzwi Dania.
b73d3348-f5ae-4e3e-9059-ce33c6112bdd,19430acf-9e45-4486-ad32-700f7799f349,2024-10-09 00:00:00,2024-10-11 00:00:00,Narodowy nóż cienki świadczyć organizm.
2a0cfe58-abf3-4ff8-8fa9-b8a9f72a1202,f5cc9502-7674-4427-9123-1640891d9ee9,2023-09-26 00:00:00,2023-10-05 00:00:00,Przemysł wschód wola policjant wakacje.
62646e08-0991-4bba-9665-fb8a3ce207e7,7aa9a776-4373-4693-a911-1313b2c33a12,2024-10-28 00:00:00,2024-11-05 00:00:00,Wykonać otrzymać szczęście dziewięć.
9edc6459-79b6-4925-b503-7616fc97555e,5bce59e1-f58a-40af-80f7-aa653f30d283,2024-06-13 00:00:00,2024-06-14 00:00:00,Rolnik lis róg chleb taniec wyglądać liczyć.
c834357d-71ce-45be-9f64-09c014dcb5f2,b2962ff7-aedf-4bf9-80e1-3f01a6d76c78,2024-04-15 00:00:00,2024-04-25 00:00:00,Górski ojczyzna wiara telewizyjny lis śmierć policjant.
4072055f-560b-42ba-82a8-26edffed7cfb,61412ed8-4459-4f92-b787-0eb9832e3777,2023-03-03 00:00:00,2023-03-12 00:00:00,Skład pamięć minister znaczny.
0cb5d21d-c722-4d8a-9712-fadea8bbb02f,0f353811-8df8-4f81-bf61-3e89b1b4852f,2024-08-11 00:00:00,2024-08-20 00:00:00,Prowincja powiedzieć róg złoto wszyscy.
d5cdb53a-9da3-41fc-9972-8b39aec6dc3f,df7037a1-1624-4b14-8460-292e9a643977,2024-04-04 00:00:00,2024-04-13 00:00:00,Zwyczaj mięsień stolica.
291d2ab1-a0d0-4cd0-bb05-821df3d0d70a,4e32a27d-1a45-4480-b85f-5aca4e07d69d,2024-08-13 00:00:00,2024-08-20 00:00:00,Biblioteka kupić właśnie wciąż.
da9e12a2-4365-4407-8dde-3ff0b9adc15b,8c39cef0-5fb2-4fcd-abef-30bc3a7a1249,2024-04-02 00:00:00,2024-04-06 00:00:00,Mama zaczynać spokój lud.
bd261e6d-129a-441b-bb36-bb9d4266572e,9409f6a1-0991-4420-8a1f-abe3725d39c4,2024-12-23 00:00:00,2025-01-02 00:00:00,Linia czynić projekt.
c20d542c-61aa-4d98-ae0a-622819f389b7,505312a5-2f6b-4497-9d7a-552be4113473,2024-02-27 00:00:00,2024-03-08 00:00:00,Dowód odcinek filmowy srebrny przygotować bać się wokół wewnętrzny.
686dc641-8061-4b8d-9bd6-2c722f40c1cf,c18ad744-b97e-4fb0-b6c5-f7c6b5a42c3b,2024-03-20 00:00:00,2024-03-26 00:00:00,Określenie pomieszczenie fotografia okręt od wieś tkanina.
93fd68c3-8730-4062-b6e7-d74cc02cea11,19c051e4-85d0-4032-a2bf-6fdb57dfe0a0,2024-09-21 00:00:00,2024-09-29 00:00:00,Gatunek stopa przeznaczyć dolina ćwiczenie student postawa jednocześnie.
5e8f86e1-0715-4f99-be9c-cfd409973e0e,550ee9f8-16cc-41f4-8933-e743d5368a60,2024-02-22 00:00:00,2024-02-26 00:00:00,Oznaczać żydowski zarówno barwa stolica ofiara.
850c9cc3-5d95-4e83-a0be-1591a245278a,bcd4fff1-5536-457e-80a2-5bff497313e7,2023-07-03 00:00:00,2023-07-07 00:00:00,Numer Niemiec krok wynik ciotka metr Belgia.
e3826d64-9ed7-4aa5-a3bb-6b7e338d0c31,3d47b09c-9d0e-407b-9fd5-21471355e7b2,2024-10-13 00:00:00,2024-10-16 00:00:00,Tył ciemność powstać odwaga tam.
7ab91af2-4312-4a69-ae39-b708e342a701,6907bbf5-4eb6-4669-8d15-80eb23e8e18b,2024-02-08 00:00:00,2024-02-15 00:00:00,Głośny słyszeć własny uzyskać literatura.
988f0ff5-279f-48bd-90ab-6d7bb9f5d2d3,9aa995d5-061f-4661-9048-1ad6f0cc7ab1,2023-01-21 00:00:00,2023-01-29 00:00:00,Który komórka mięso szczęście zjawisko.
8e6bdb9f-09ce-4e49-9ada-5cc4e2a6fd8c,6d742811-3001-4124-9d23-13ce2d09eafe,2024-10-28 00:00:00,2024-11-05 00:00:00,Żołądek późno gwiazdozbiór wyrażenie Boże Narodzenie kobiecy Anglia.
cf047225-c675-41c0-acd7-cf1344e1aa01,3ce5f2c8-0a8b-4c0c-a540-2eaa02639e50,2024-10-09 00:00:00,2024-10-18 00:00:00,Spór japoński średni także ponownie w formie szczyt kupić.
c347f0a0-9f9c-4d5a-bc4f-2befd86b05f7,807cf1b7-6769-435f-af46-a0fc2519fc31,2023-01-03 00:00:00,2023-01-12 00:00:00,(…) który pracować wrażenie tysiąc ciekawy.
1bd9b968-a450-4974-b56e-67f2d3834737,c1c50418-e7b7-4fba-98ca-59691cd245f3,2023-07-18 00:00:00,2023-07-28 00:00:00,Ono powiat brzydki.
13cd41b0-3166-42bb-a824-086ea2091487,c214a95b-e016-46e5-94b8-db5c778db121,2024-12-18 00:00:00,2024-12-22 00:00:00,Mysz poziom większość matka odzież.
76712942-eb80-4952-a37f-cd77ed8fc2f4,2f91d40e-8315-46d1-844d-dfc1afac3053,2024-03-27 00:00:00,2024-03-30 00:00:00,Toponim podać władca mieszkać Chiny dać się ustawa.
cf99c9e5-285b-4e38-a0b0-10cea55acfbf,72953e9d-87aa-49b7-bdc9-b0cfbb338e3f,2024-09-28 00:00:00,2024-09-29 00:00:00,Ile muzeum produkt stary odczuwać majuskuła.
fb8e0de5-c8d2-4a48-a926-064b508d8db5,d5efd108-8bd1-44b5-b9e6-3f653542c465,2024-11-06 00:00:00,2024-11-16 00:00:00,Brzuch nic drewniany czynnik dziś Słońce śpiewać.
317479aa-70f5-4195-a19a-a3f8c16f938b,3c823d16-5bf4-4b4e-b893-c7847205f590,2023-03-21 00:00:00,2023-03-24 00:00:00,Technika fakt przedmiot stacja robić sprzedawać zegar francuski.
34e7b799-8e0b-4f74-9d24-4e2c14c0db95,239521ed-6cdf-4346-a1cc-6a5a52c84696,2023-07-26 00:00:00,2023-08-04 00:00:00,Nosić jadalny brzydki kolacja struktura.
7117778d-43f3-4c29-af36-23239ce70abf,6847343b-4fd8-4c5c-89e5-0819b7677cd3,2023-04-08 00:00:00,2023-04-11 00:00:00,Panować oś klimat wybrzeże kościół górny wczesny.
4e810f1b-c161-41d0-9c98-0b388905713f,33fa1ebb-8a3e-4815-b729-d05a45539210,2023-02-13 00:00:00,2023-02-20 00:00:00,Rzeczywistość miłość zamiast budowa kij.
688a4273-b80e-4275-ada7-6bb2dbe36d87,ad9af63c-08d4-4573-b293-94712e447e41,2023-03-15 00:00:00,2023-03-20 00:00:00,Mało oglądać siedzieć urodziny stawiać.
927223c4-0215-432c-8300-998e25b2968b,2922898e-53e9-4d46-b7bf-166aa38d5512,2024-01-17 00:00:00,2024-01-27 00:00:00,Technika herbata wykonanie połączenie młody Anglia drzwi liczny.
c62d02f1-96e4-40a7-b782-bfa7dfbbcab6,bd865cb9-e261-4afd-90a3-900bbb03dc22,2024-01-27 00:00:00,2024-01-29 00:00:00,Inny osioł za jeśli traktować niedziela.
cc8c8ac1-e8b2-4f7d-b89f-ab5698d1cb8a,e170d66d-0fea-4e4d-a4e7-8ba450396eab,2024-07-31 00:00:00,2024-08-06 00:00:00,Ilość przestępstwo bić rozwój ulica pociąg port.
35f620bb-9eb4-42b8-8c49-cfb42f172fc3,e5cd77af-458f-4a2e-a7e4-e14c3322b8fb,2024-06-06 00:00:00,2024-06-12 00:00:00,Mówić żywność rada coś postępowanie płaszcz.
00de202d-6236-4513-8363-022d1230f602,fb1c9327-b81f-483e-a945-435865a3e83a,2024-11-23 00:00:00,2024-11-25 00:00:00,O kupować wywołać.
99b747f0-a2e5-4dd7-9620-043f2470cfd0,5bc6c292-21f5-47f8-8591-e3eee5a25c90,2024-02-28 00:00:00,2024-03-04 00:00:00,Gorączka tani szybki działanie wyrażenie.
436dfa1e-e382-4205-9c8a-ec53a88b477b,f26ce6ee-4aae-442a-bfe7-a1ca5aadc6b4,2024-08-05 00:00:00,2024-08-10 00:00:00,Szkoda lud żeński szkodliwy zaraz daleko nadmierny.
a39fac46-5d37-4e6b-ac1a-f4173c831e58,bf09689c-ded5-45d0-a74b-a552f27ff281,2024-09-29 00:00:00,2024-10-08 00:00:00,Fizyczny czarny ukraiński cichy składnik.
7b770e76-782c-40ff-9e41-5ec5fe655508,4a309058-179e-4c8f-89b1-a27593a0fc8e,2024-06-15 00:00:00,2024-06-17 00:00:00,Deszcz plecy naj- obywatelka.
2455a294-397b-4840-b97d-683893a573ad,b58e5114-42c3-44f3-9331-340d40db7f1f,2023-01-31 00:00:00,2023-02-09 00:00:00,Słowo psychiczny wspaniały 3 przedstawiać słodki podobny.
acc10073-5f1c-4180-8388-f43a4e80ccce,b1efe8e2-7029-4679-89bf-4f2d2541e594,2023-03-17 00:00:00,2023-03-18 00:00:00,Jedyny zdobyć żart o słownik przepis.
57ff89ae-34f7-49ad-835e-a3ffdba8d70c,8ebee7fb-c774-4a9e-a5db-753b1c7ca877,2024-11-02 00:00:00,2024-11-07 00:00:00,Wiedzieć sobota działanie szczególnie głupiec żywność miłość piwo.
a2d5e8d7-fae1-400b-864e-c3b8ef6ed9dc,e61d48e8-180e-4084-a154-8f8391749bc2,2023-02-04 00:00:00,2023-02-06 00:00:00,20 śmiać się łatwy.
feb0438d-0351-46bd-95fb-c6f3543449f0,80a7e989-948e-4bbd-9d5f-7214e8f31844,2024-02-07 00:00:00,2024-02-13 00:00:00,Fizyczny suma katastrofa.
22f216f5-f979-41bd-b41e-cbb77ca992fd,c6731100-e14a-434e-bc50-288650a6c70b,2024-12-16 00:00:00,2024-12-19 00:00:00,Przyszłość imię planeta nigdy stanowisko szukać.
8498918b-e543-45db-8201-3938ccad7033,a7cad544-3767-45b4-a58e-a46063ced5b3,2023-08-29 00:00:00,2023-09-03 00:00:00,Sok brązowy siła działalność płaszcz pogląd sąsiad.
d328f6ed-bd91-41cd-9ccf-b258affe2de2,71d210e8-f20e-4182-a250-b3da7e399744,2023-09-14 00:00:00,2023-09-17 00:00:00,O urodzić się imię szef dyskusja szkło miękki dać.
8b59343e-d7fd-4af4-87ba-8de397529893,366cbb78-e13f-4e59-a844-7b967aefade5,2023-08-22 00:00:00,2023-08-23 00:00:00,Zły odpowiedź gmina Kraków.
a455a326-61ed-4655-b8c6-ffa8ab75fba5,a54db4b5-cb3d-4d04-8d76-1c418737b11a,2023-01-10 00:00:00,2023-01-11 00:00:00,Znaleźć krok kraj zjawisko mieszkaniec.
c08234b1-5d16-483f-931e-ff36e2eab516,bd501634-3c8a-49dd-9f00-d5e7743bf328,2023-12-25 00:00:00,2023-12-30 00:00:00,Moralny historyczny pić wielkość.
7e08ce2d-098f-4bf1-a4fe-3a1730189150,6c281621-0bf0-4c63-891b-ce1a8b1ed3ed,2024-09-12 00:00:00,2024-09-21 00:00:00,Hotel dziura pomoc funkcja lecieć tyle.
3f1bf6e8-a841-44b4-8fce-f47e28e03823,abe3fc8c-6aab-4bad-b9ff-5628651a7231,2024-08-11 00:00:00,2024-08-14 00:00:00,Oddech średniowieczny komputerowy wy właściciel but.
e46389f1-484e-41b4-809d-002935e67cfb,2596d992-480c-47bc-994d-37b854c5628b,2023-10-08 00:00:00,2023-10-15 00:00:00,Choć wrzesień pojemnik.
44885765-5b1c-4434-98d6-8ca824aa515c,78ec8bb2-b0b9-41f1-89e6-c8874e4f820b,2024-07-25 00:00:00,2024-08-02 00:00:00,Stracić jazda określony łąka.
51ce0466-638e-4763-a5b4-5f267e6f2fed,5fe0ee27-8ea7-438a-aadc-781d5ba1222c,2024-08-11 00:00:00,2024-08-12 00:00:00,Zamek można pozbawić.
6c4b3dd5-3fc4-4155-b35e-da27ebbd0fb5,9c2d7ca7-ce1d-45c8-a029-e80f9a67cafb,2024-06-04 00:00:00,2024-06-07 00:00:00,Bogini skała płeć pod dziki system dość.
0acaafef-de44-4c9f-a703-d542410f3675,7705a68d-d7e5-41fe-a7ca-ed3fa078565d,2023-10-22 00:00:00,2023-10-27 00:00:00,Wielka Brytania słodki zdjęcie władca rzadki sprzedaż.
f3288612-6844-4995-91ef-faa2c53a803c,9410cbce-12ca-4111-8d33-3e7a1e5a9a75,2024-12-25 00:00:00,2024-12-30 00:00:00,Krótki całkowicie oczywiście plac wszystek zabawa kraj.
2fc7c2b9-f3c1-46df-be3f-fe51f6552df9,c5f2a20d-8a63-4063-83d0-a9d2b11444aa,2023-06-21 00:00:00,2023-06-27 00:00:00,Barwa drzewo przeciw zawód kupić bank koszt zaburzenie.
