id,return_id,issue_date,resolve_date,complaint
79b20d44-a3a5-4bb4-9f98-599d6f38bde1,7811b121-463a-4ecd-bec8-303afaea9e27,2023-05-28 00:00:00,2023-05-29 00:00:00,Zawodnik narodowość tradycyjny czysty wynik ptak zamknąć musieć.
0efa417d-4d6f-429a-866d-c9d99abe5e15,16a5b743-0662-4cfd-93ec-3d142c6ca890,2024-06-23 00:00:00,2024-06-28 00:00:00,Wykorzystywać budzić rzymski.
84e4b9d4-aae1-4a88-8825-d68541a4cd10,6b4ad6c2-8e13-4632-b35d-71798d250993,2023-03-11 00:00:00,2023-03-16 00:00:00,Bogactwo wojsko gniazdo cień mężczyzna cebula niedziela.
06007aa7-512d-4d7d-b725-d097bca78ad4,74494cb4-5d84-4108-9083-e63f33151a74,2023-05-13 00:00:00,2023-05-22 00:00:00,Związek dziadek samochodowy żelazo oś muzyk włos.
5e9f6f15-b412-4692-9ace-2702d46a1e7f,e885bcd0-bca1-48d0-8047-382612f444dd,2023-11-09 00:00:00,2023-11-14 00:00:00,W Wyniku dziewczynka nadawać 3 przyjaźń charakter wola.
377e81c1-1bf4-46cb-b27d-c4fa5ef96659,84f71a1d-3872-48fe-98be-e650a9a72749,2023-03-29 00:00:00,2023-04-07 00:00:00,Zawartość tamten parlament pełnić matka gruby własność.
a60a0783-d00a-4c8f-898c-a8bc62b3e789,8ae90575-b626-4a50-820a-6c380223e4b0,2024-09-17 00:00:00,2024-09-20 00:00:00,Komputer dusza spaść dodać.
c9b686a6-0cdc-4361-be16-a13dc249d405,a063e259-a019-4ba8-b6e0-6320992c0e1e,2024-04-22 00:00:00,2024-04-30 00:00:00,Statek rząd dyskusja region zbiornik.
0661fd2d-8f04-444b-beab-2f18052ca2b6,3262b645-2a78-45ae-9bde-2cfed769ce7c,2024-08-26 00:00:00,2024-09-01 00:00:00,Tłuszcz sztuka twarz obserwować.
c3a1d095-711c-408f-875e-1e120c0fb1fb,219a4bd7-4a1a-42a3-82b4-b8262ab783ba,2024-02-13 00:00:00,2024-02-20 00:00:00,Filmowy stan urząd poduszka zrozumieć wokół.
302d35e2-4bac-487f-90fa-e2d004d8a3a5,78b47c69-504f-4dae-84c2-494791e8bb08,2023-10-26 00:00:00,2023-11-02 00:00:00,Indie ojczyzna zmienić tani kula własność.
ac483f8e-d84a-433c-8ce3-7d9b2e51d6e9,98fa24c6-6410-460b-9bab-878c63af9e9b,2023-07-25 00:00:00,2023-08-04 00:00:00,Źle nie zostać zbudować.
49999a2a-a722-4d50-9ce5-788eebfc372d,5c2b3614-12bb-4abb-b23c-d734faf6d732,2023-11-12 00:00:00,2023-11-16 00:00:00,Zatoka panować element korzyść wpływ 4 rozpocząć.
6cf0c615-af98-472c-b277-482c16c2c477,eed3668f-3e48-4c98-8592-577fd3947d04,2024-07-28 00:00:00,2024-07-31 00:00:00,Metalowy policzek szef wojskowy trzeba.
23599dce-949e-4343-bfec-33339d2abb2e,052341b4-b7fa-4163-a9a1-63445484bcf1,2024-08-18 00:00:00,2024-08-20 00:00:00,Domowy urodziny siostra komputer tam.
b0c83401-cf04-4a37-bde9-2700bf541b64,244533e2-d623-410f-95b1-d711f277b0f4,2024-08-12 00:00:00,2024-08-22 00:00:00,Ciężar temat kolejowy rower prosty średniowieczny papież.
a9c4dc2d-fa63-4334-8b8e-b014fe9966d0,8377a709-672e-4b31-9e63-6d765563f143,2024-12-11 00:00:00,2024-12-17 00:00:00,Zazwyczaj przyjść ciemny zdolny w celu wyścig.
df2c47d1-a180-4453-98c7-e4ec202bc90b,05a82e46-57db-4a5e-a75b-9a167ca6f25c,2023-07-07 00:00:00,2023-07-15 00:00:00,Jabłko aż broń użyć religia sprzedaż archipelag.
a7b58baf-6811-44bc-b582-e9390cc89f52,acbb1625-d89a-4a8b-a047-9de16601824e,2024-02-08 00:00:00,2024-02-10 00:00:00,Znajdować wiele Węgry patrzeć szeroki grunt złoty.
ff17bb7c-d7e4-4971-bda8-f113aa07e81f,a94a7a2b-81dc-4ddd-9673-88a742a93eff,2024-10-10 00:00:00,2024-10-17 00:00:00,Zdjęcie osioł wpaść.
c911b3ea-640c-4230-8c2f-d00fdebdfd86,2a3363f4-eef5-4539-9014-a42afa67d7b1,2023-12-19 00:00:00,2023-12-21 00:00:00,Wchodzić uderzenie centrum tekst wybrać park.
8499d524-0e64-4e50-84d4-73f157878103,4ba37d5e-5e57-4789-922e-2c5340ea187c,2024-02-29 00:00:00,2024-03-01 00:00:00,Proszę ile plecy spotkać zmienić średni ośrodek rasa.
3788f987-9ff7-419a-9024-48ae91dab0fb,37c4d996-9990-408e-b99b-44c1fdc871f0,2023-08-16 00:00:00,2023-08-22 00:00:00,Uprawiać zbierać społeczny pogoda.
4a3138ec-b5ae-45dc-891f-1117660e6ecd,f9ea7433-36ed-4599-a869-d17d29e96a7a,2024-05-26 00:00:00,2024-05-28 00:00:00,Polityka tablica artystyczny śmiać się.
10425de3-5860-4195-b648-ae484d423211,f0e47fc8-55b1-4c5a-bdf7-49772944d37e,2024-06-15 00:00:00,2024-06-24 00:00:00,Igła dokonać nosić Afganistan obcy.
5442d335-2bf1-49e0-af74-1a813541c48c,e5a13e80-6190-488b-a1c3-bff0fd9c7501,2023-04-22 00:00:00,2023-05-01 00:00:00,Mieć Na Imię produkcja określony Unia Europejska.
fae00182-9b84-43c8-9038-0263bda27760,f68bc8df-667b-4fa0-944d-51b2d3b485cd,2024-05-04 00:00:00,2024-05-05 00:00:00,Kształt miecz urodzić uznawać 9.
3c63980c-f228-4fc9-9fac-b802273a68fc,899a0109-0282-4542-a3d7-a14ce0d35ba7,2024-08-21 00:00:00,2024-08-30 00:00:00,Daleko np. drewno szyja.
1c257950-d69f-4d19-b9ab-448011cc5238,15cdf7da-b1cf-4104-a4f6-09153d89c3bc,2023-05-05 00:00:00,2023-05-09 00:00:00,Myśleć pół ryż ktoś Unia Europejska zdjęcie wrzesień dokładny.
10ccb231-e6a2-41aa-a0cf-eeece65d9783,09d110e7-0a75-47af-9ef8-3af1d6a5faf0,2023-06-11 00:00:00,2023-06-21 00:00:00,Ziemniak handel powinien (…) arabski.
29a30039-e65e-4a02-88e0-ae7a80f2794a,c4964fa1-371b-4190-a0f8-3ff43a6b6eea,2023-03-24 00:00:00,2023-03-27 00:00:00,Przyjaźń okropny sport element kupować godność.
f6d6cd78-edb9-4ba8-9095-69153cb23220,234e207d-fb57-40e1-bf2c-c9558b40ef86,2023-06-05 00:00:00,2023-06-13 00:00:00,Złoto połączenie cześć ciekawy dalej.
41857b31-8283-4471-aee3-a7590236d4c2,ded666a3-a661-48e3-a0e1-9cc5c1cd03f9,2024-04-01 00:00:00,2024-04-03 00:00:00,Ważny dół ulegać dziki dodatkowy alkoholowy.
88c9858f-ee22-4a95-9c9b-a55d56938cfb,32219d5d-ed40-4e4b-9bee-d7654625aa44,2024-02-10 00:00:00,2024-02-12 00:00:00,Rzecz niektóry zdrowie krzyż.
6f20b5f9-97e0-4127-b93c-974c148a2cb0,00c43b38-c5f8-41e1-8ad5-33f914b1f853,2024-12-11 00:00:00,2024-12-18 00:00:00,Wojna sklep nosić wesoły but dziwny ból.
a4f683fe-eb2f-4b7b-bc1c-863723e2e132,7c52d4b5-d080-4401-bad3-ab96c50818dc,2024-07-31 00:00:00,2024-08-04 00:00:00,Teoria szklanka zapis bieg drzewo trwały zwierzę krzyż.
ac10cc39-efb1-4e80-9eea-0efadd68c1ab,3a0e3815-c28d-4bae-9786-577a2ece547c,2024-11-10 00:00:00,2024-11-18 00:00:00,Poprzedni głęboki ofiara też lekcja.
d578acfd-4494-49a9-a250-7f0f26fdcdb9,5c8608b3-a9d6-4731-b5a4-abcbe3e51f04,2023-02-26 00:00:00,2023-02-28 00:00:00,Osiem Pan list nasienie.
cf8f1fd1-18d7-4fb2-b87f-10a345bdb449,ad6a0789-ce19-47ef-b452-8a63c1a24255,2024-04-29 00:00:00,2024-05-03 00:00:00,Dziewczynka czytać wśród filmowy.
765f5d16-7c59-4d95-a863-a75a31c1564c,f2acbd12-1eda-46ba-af98-e1963e7b9d12,2024-07-05 00:00:00,2024-07-10 00:00:00,Mężczyzna herb niezwykły stać.
ace0313b-1d5f-4627-9cb1-73efceaae8ce,8efaf200-dc77-46dd-92d2-52daa377fff7,2024-09-27 00:00:00,2024-10-06 00:00:00,Piętro krótki większy używać jądro.
d800e768-954a-40e4-a7ee-f0c0445940ca,80e00631-9705-4e93-be24-289e5d262c20,2024-06-29 00:00:00,2024-07-07 00:00:00,Lina brak ósmy leczenie udział.
e32ff8a4-ea65-4e43-a0a3-541bd76b8243,de95ae38-f354-4c2e-b334-9ab8e21f6fe8,2023-06-12 00:00:00,2023-06-18 00:00:00,Więzienie jednak godność wykonywanie bydło urządzenie oglądać dawny.
636cebc3-af95-4dcb-84e8-6cad9b85faac,11b403ff-1700-42b5-b2af-b6d3912aaf8e,2024-06-23 00:00:00,2024-07-02 00:00:00,Dziwny gwiazda daleko mrówka dokonać.
68d75a22-d893-4ccc-9ae2-4c5680c1afe0,199d2679-571e-40ff-81fe-9f9f26696296,2023-03-23 00:00:00,2023-03-24 00:00:00,Otrzymać technika spotkać może drapieżny.
ace1008d-87b4-4cce-b5e7-0934d142f8b9,c22660f0-8206-4351-b200-1b4bf91dd49d,2023-08-19 00:00:00,2023-08-27 00:00:00,We głos dodatek.
e30d7a53-c9d1-4fc0-b23c-eac7f9ed6c14,8be802cf-6ea4-46f0-8340-8ae010c9dd33,2023-05-31 00:00:00,2023-06-09 00:00:00,Upadek naprawdę młody ważny.
19f7a40e-48c0-4abf-b632-a0b8e2f3965e,d26a8c0f-51eb-4d1d-bdca-55f6453f2929,2024-12-21 00:00:00,2024-12-29 00:00:00,Mysz dzielić prawo wystawa zawodowy.
d13b60a4-0977-4ed1-9b1d-a51a1ad1f7c0,17189b22-30f6-4950-adf4-975f00313801,2024-06-14 00:00:00,2024-06-24 00:00:00,Miara Węgry warstwa dobrze światło rzucać poziom.
81cf4c0e-3b01-43be-9068-80ceffb9ff45,d72ffc0a-cc12-4da9-8123-af8c64cf78a7,2023-09-23 00:00:00,2023-09-26 00:00:00,Sztuczny bycie rodzaj okręt rozwój.
38a7767e-82f5-4b06-8dee-527f2db91e95,79b3e1e4-0311-45de-bced-b23243998c59,2024-10-15 00:00:00,2024-10-18 00:00:00,Budować rana sport rzeczownik inaczej Australia.
5016ba25-f7ce-47cb-bd60-a57d57056ff5,a3bb83d0-1cdf-4289-a831-7bf0b1fc1e0e,2023-12-19 00:00:00,2023-12-21 00:00:00,Zaufanie Australia róża dlaczego powiedzieć.
3eb3eef6-ee22-4926-96bd-4f03af070151,9adae6d8-f5b2-48d6-93cb-2abc678ed905,2024-10-09 00:00:00,2024-10-17 00:00:00,Rodzina ciemny zaufanie wykonać klasztor królewski czwartek.
76688d93-5bca-4c15-9db0-55dda46f9473,d0dcc19f-57c2-4ed3-919e-2c494d03d3d8,2023-03-09 00:00:00,2023-03-10 00:00:00,Stary centralny polityczny wysyłać.
3c50a39b-de35-401c-b309-b7baccb2cb74,da80fa90-c5ca-4792-9cfc-c36af7d978b9,2023-11-15 00:00:00,2023-11-20 00:00:00,Świat korzystać znaczenie.
004f38c9-290b-4693-bca3-16d884de34d7,7ad8ac87-2765-465d-a732-bd4470929df9,2023-06-30 00:00:00,2023-07-10 00:00:00,Osiem bajka wystawa szczególnie.
8f43ea3f-14ad-4691-89c1-e5f216ae2276,73360223-3b44-40c8-978e-676b3395ab91,2023-03-25 00:00:00,2023-04-02 00:00:00,Chleb archipelag połowa większy prędkość wskazywać zaraz zbiór.
2bad777b-de57-4d18-8dcc-443b2844323e,969630e4-f42c-425f-a429-044c46a2a8cb,2023-11-07 00:00:00,2023-11-13 00:00:00,Polegać coś szkoła zabić.
fb482393-7cc3-4661-91d2-5a52ab9dba00,b1ce98c6-8320-4dbf-a30c-d0396d6bcead,2024-11-08 00:00:00,2024-11-13 00:00:00,Księżyc - wykonać atmosfera zmarły zamiast kobieta.
061ca90d-97e6-4cbc-bad9-392da4b29bf8,0d9fe99d-3e11-45a4-b681-4575c89be556,2023-01-29 00:00:00,2023-01-31 00:00:00,Zima bądź uderzać religia czoło zamknąć czas.
d42c391f-43b2-426f-a874-090a8f45e113,d54c4fb2-de4e-4ab2-9c1c-ea1a7ed9e4df,2023-03-11 00:00:00,2023-03-15 00:00:00,Umiejętność oni równy narząd dać obrót.
b32e4b21-0e25-4ffa-9ed2-50328db39122,20d1a97b-f993-4a95-b2c1-a1002b965c6f,2023-08-26 00:00:00,2023-08-30 00:00:00,Próba śniadanie pacjent dorosły przemysł znosić bok.
b5d6857a-bbd9-42ac-b0ac-0ed41a5ec30b,070134c6-a98f-4584-aa4e-1a7a14a65db6,2023-02-13 00:00:00,2023-02-19 00:00:00,Granica dźwięk Kościół.
88cf07ea-3436-4b1f-9866-61ae80564589,fc6f51e5-1817-4171-bbf1-9ab88a4a3a10,2024-08-16 00:00:00,2024-08-17 00:00:00,Kultura Pan 5 wysoko.
c85309be-7cff-470c-8216-6a746ede98e3,0c173b0d-903c-4734-8d35-e66fc12c072a,2024-08-13 00:00:00,2024-08-19 00:00:00,Główny powietrze wierny owoc znak port.
849edbaf-7088-4ef7-af4a-dd4c813d9e4d,28c457cd-4bb7-4163-a10d-89c0aa07ca26,2024-11-14 00:00:00,2024-11-16 00:00:00,Kara tytoń użycie radiowy.
900e3de6-93a5-4447-b863-a38da6bfece5,61f10fd4-b578-4dfd-8540-19e6ea145613,2024-02-21 00:00:00,2024-02-25 00:00:00,Dodatek Afryka rolnik nagle szczególny dawno stado martwy.
ecc6990a-6b55-42f5-9152-f9a5ce8ba9ad,39e4e8b5-e4c5-4eb5-8753-8ed2e1963b3e,2023-04-04 00:00:00,2023-04-08 00:00:00,Poważny np. ostry.
09a601e7-4b70-4d30-be8b-f09a6dbc4293,aa926fc6-e345-40df-a9f1-b6ae5d88e59a,2024-10-03 00:00:00,2024-10-09 00:00:00,Kierować postępowanie odnosić się badać mówić polityk.
36bb0883-8c0e-4004-b66a-dfa2bff2a060,8f7f6d09-e0bb-4290-a0ab-2ee126663816,2024-03-10 00:00:00,2024-03-13 00:00:00,Minister sytuacja pozycja uczyć św. wódka.
fe05fa9f-7ccc-481b-aedc-ec45d00362ad,8a593191-22e8-4188-921f-e4737ac8cc4e,2024-08-12 00:00:00,2024-08-15 00:00:00,Noga region zespół gotowy lubić idea wyraz.
94512cc7-2140-4369-920f-55efcbe81a2c,3e5bfe05-f0b5-495b-88ea-b5e3c06425e9,2023-09-26 00:00:00,2023-10-02 00:00:00,Autobus ilość także wywołać szczęśliwy.
9dd675c3-4786-4681-bc76-2347bfd4218c,0f6756f7-f020-4e7f-b692-58c17427759e,2023-09-09 00:00:00,2023-09-11 00:00:00,Możliwość filozofia znak pytanie.
2a5c31bc-245d-4106-9dd1-77483cc8c7be,5fa8b8bb-4736-41b1-bf2b-c11ae12fc77c,2023-03-05 00:00:00,2023-03-10 00:00:00,Kwiecień książę teren Włochy wyrok uczucie oni.
53fe1c44-b3af-43a5-94ea-d3e5b9acd807,4fe988e7-c3da-4139-9062-63e1b616ad63,2024-11-05 00:00:00,2024-11-12 00:00:00,Wokół transport samochodowy religia nigdy.
c7554cb3-07f9-4154-9743-2aecf54cb41c,5f1e8483-8e66-4d5b-abb5-c0b137df5e27,2023-03-29 00:00:00,2023-04-06 00:00:00,Obywatel pani specjalista terytorium średni ksiądz.
780f2287-7fb3-436d-a7bc-c5cdba966413,e7e66399-3e7e-4116-8f88-3c5b394d359a,2024-07-31 00:00:00,2024-08-08 00:00:00,Urządzenie jazda niektóry strumień zanim owad.
c9ee4e11-c17e-4885-99b1-c7be94dcbc10,023ac84f-4535-4b13-94bb-c6005c22b3cf,2024-02-15 00:00:00,2024-02-19 00:00:00,Olej wąż ukraiński Żyd kwiat.
c5b61037-9603-4700-b17b-09c060d7f0db,49b8d0b7-6e15-4bb9-89f0-040010ef0452,2023-12-22 00:00:00,2024-01-01 00:00:00,Świat kontrola wąski zmarły chleb kawałek gruby.
c9018922-8625-46db-a89b-ed651f0a694f,57212fbb-e3e6-4a5b-8476-7d0030df3063,2024-03-09 00:00:00,2024-03-12 00:00:00,Liczny ogół teoria praca właściciel grać przeciwny.
22b4a3e0-5767-4d83-ad87-0f10e3e497fb,f5b3cfcb-0066-439a-a611-658eb4611a0b,2023-01-26 00:00:00,2023-01-30 00:00:00,Numer dokonać terytorium pierwiastek literatura (…).
9004bc52-4bcd-4956-a2ac-807a5ab0663a,3f894718-0394-4898-8de9-dc93d4232f5b,2023-02-24 00:00:00,2023-02-27 00:00:00,Los Rzym żeby stawać się tysiąc.
838d942a-b8da-42d9-8281-4d578c6d4560,8825d39a-2cfb-4e3a-9a94-f4fb356ae6ad,2023-12-06 00:00:00,2023-12-07 00:00:00,Tamten ozdoba kosztować element.
90a5c7a5-f886-4d0c-b689-b3dd90bcf7d6,380eb7d3-c5ad-40d7-bfda-184917c67669,2023-06-28 00:00:00,2023-07-06 00:00:00,Ogólny małpa rodzaj zajęcie mieć na imię komórka.
82e89e93-4370-441c-a14b-ef137114ba95,7648f9fa-dc32-4ef0-9ce6-e1178644565d,2024-07-21 00:00:00,2024-07-22 00:00:00,Udać Się wieczorem tysiąc składać pustynia babcia głupi.
c668d2d5-a307-48a4-98fa-d30e00766c98,575b799c-f44b-4d1b-a64e-1a382c23668a,2023-08-10 00:00:00,2023-08-17 00:00:00,Postępowanie u oddać gruby.
70134d59-4d5e-4aaa-8a79-97f8a329379e,a0d3560d-af0a-4425-bae7-8af6b3c72467,2024-10-03 00:00:00,2024-10-11 00:00:00,Męski morski biec mur.
ff5a4e64-d009-4365-a601-a43c855e5fee,d912df65-4436-431d-b56f-2c8692c1949d,2023-05-22 00:00:00,2023-06-01 00:00:00,Jedzenie urodziny linia kostka przedstawiać.
41734bcb-612c-4c5f-88c9-3d80bffa9a89,30e1d2cb-23c7-4bb6-a9cf-3d33b8716469,2024-07-08 00:00:00,2024-07-15 00:00:00,Korzystać system Jan np. prowadzić.
9eb807a6-512b-470b-a71b-cec456e6549a,23cf6046-58f3-4a98-82a9-231461d8f8db,2024-05-09 00:00:00,2024-05-11 00:00:00,Obcy usta kij ze deska.
a6ecd32e-f9bf-4ede-b4da-2b3b898dbfd0,44fcd133-94d8-4efd-ae93-e3c8eb06edba,2024-05-08 00:00:00,2024-05-12 00:00:00,Wskazywać rola dziewczyna przeciw w celu.
f5bd32c9-0131-4e6b-ad13-ebca9c736720,99f2a44c-18e3-4661-a0e9-9d48695b2bac,2023-09-17 00:00:00,2023-09-18 00:00:00,Odpowiedni nigdy skała półwysep.
ff7d50a5-b8b4-4ab1-b735-248eda68311d,509afd34-14ab-4461-b3d2-47cfde1d2e0b,2024-11-25 00:00:00,2024-11-26 00:00:00,Zakład średniowieczny za przemysł ani wytwarzać chemiczny bez.
683a8aa7-a954-4e1f-8e61-32194e488b1a,32d047ce-9e2e-4f21-814e-bd5e1800983a,2023-10-13 00:00:00,2023-10-16 00:00:00,Żyć piątek mięsień przestępstwo Chiny Wielka Brytania.
356cf429-6655-455a-9ab5-2cf0e1a17c72,b6c35a65-f15c-4d38-985f-474ca2752ca9,2023-04-03 00:00:00,2023-04-10 00:00:00,Kierunek jako ale lęk brać —.
b9c38228-5fe8-4a2c-b54e-f515a506c648,cdcc7979-3b60-4c2a-a871-416d66a32dc8,2023-10-12 00:00:00,2023-10-14 00:00:00,Skończyć deska polityk grunt królewski wielki.
b1e11694-2855-4ef1-8e6d-da4d5a57a3ab,479aab77-1cd0-477a-b7e0-f7fa435b79f4,2023-03-10 00:00:00,2023-03-15 00:00:00,Węgiel lustro naukowy postawa słowacki.
0a945463-703f-4cea-b224-0cbdc9c77ea0,cd19174d-086a-47e8-98c7-9175fa655a3e,2023-01-18 00:00:00,2023-01-24 00:00:00,Zajęcie pełny u początek procent wewnętrzny.
20498b12-65e3-4bf5-83e4-57dd94a7b158,9f0437b9-a02d-4e4f-9d8d-e015f751835b,2024-06-20 00:00:00,2024-06-23 00:00:00,Obszar pracować liczny.
3f53cf6c-4dcb-4a24-bece-b4ea39a986d0,ff39eca5-ce33-450c-821b-3dd48719503a,2023-03-04 00:00:00,2023-03-13 00:00:00,Wróg wzgórze pierwiastek chemiczny ilość użytkownik nowy.
d73411e4-bdf5-4a6d-a1b2-04619486b204,1e0fc44e-8573-4336-8223-404e494a34b1,2023-02-25 00:00:00,2023-03-02 00:00:00,Deszcz płyta bać się wola utwór.
7512af5a-7dee-41b0-8dd4-9483bad7eec7,5389043b-d9ad-4edc-b5ac-56d61c61f9d0,2023-11-08 00:00:00,2023-11-14 00:00:00,Zawodnik złożyć powietrze średniowieczny.
e5d49665-39e6-413d-965e-f96c8713701d,7e2a643d-96e6-4add-bce3-6fd6bfa068e7,2023-04-14 00:00:00,2023-04-20 00:00:00,Spadek książę nasiono ciężki posiadać kolejowy telefon.
06418438-184e-44b7-bb77-accbcef394a5,2a9b9808-26cb-4bcf-95c0-84a0b03e21b7,2024-12-04 00:00:00,2024-12-14 00:00:00,Sobą spaść wypowiedź dane domowy niebezpieczeństwo.
0e8c937f-45c9-4760-9a2c-2857e8a8510f,fdf730e0-0e84-497c-9813-f1406e1b2873,2024-11-13 00:00:00,2024-11-23 00:00:00,Głęboki rzecz zaś nagły zajęcie wieża dlatego na.
b148b0c4-a6fa-4d03-956c-4b5cabfd6f8b,7acc57f7-98b1-4598-9493-6853005e891e,2023-10-27 00:00:00,2023-11-03 00:00:00,Amerykański zgoda stawiać zamieszkiwać zachód.
63b2b525-fd3b-4bd3-83be-b64cc4b33c96,a32f2841-15b5-4c33-90cc-a9791df66b04,2023-04-09 00:00:00,2023-04-12 00:00:00,Piętro relacja wysłać palić internetowy średniowieczny jeden zabawa.
b83af370-9e24-4aa5-83c6-062cba4a03eb,a6f0191d-8b29-4dc0-a4e1-7fadffaaa462,2023-09-06 00:00:00,2023-09-14 00:00:00,Kura rower teren 0 królewski słyszeć obejmować.
3d34db06-9596-4fa4-a2e4-42aaf371b896,e29e79f4-34b0-4a25-8acc-7b9fed2a916d,2023-07-23 00:00:00,2023-08-02 00:00:00,Węgry w postaci cisza ziemia kolano pracować.
73b547e3-b52a-43ec-860b-f46fd72b01d8,fa05b0e7-61f8-4bec-9cdd-9a313e567b10,2023-10-07 00:00:00,2023-10-09 00:00:00,Koń 900 tamten oddech dwudziesty wywodzić się.
40662500-e61e-4155-8208-c9c6ab8a1269,4817e158-d872-405e-9ed5-811028e8f2b1,2023-04-07 00:00:00,2023-04-10 00:00:00,Ciemność wziąć opłata.
a9eb571a-36af-450e-9845-feec9a6278a8,cb1f2fa1-f36f-499d-826d-43f987254233,2024-04-28 00:00:00,2024-05-05 00:00:00,Ząb tradycyjny ręka czynić dwa.
1e58d28b-5ca4-41ab-ad36-58d1bbc92da4,77ff2d76-c5bc-433f-9260-2e8f2f143139,2024-10-11 00:00:00,2024-10-16 00:00:00,Dziś pieniądz trzeba otworzyć przygotować dodawać.
1780ac94-da27-47d6-9b0e-b58fdae49ec1,173eca0f-b4ea-45fb-b73b-cb6cd8542a71,2023-06-16 00:00:00,2023-06-22 00:00:00,Jednak ćwiczenie wódka początek.
94ba1ad8-666f-44e4-9f5c-290803793f60,65bf9a65-f976-4690-a815-e619015068dd,2024-06-24 00:00:00,2024-06-28 00:00:00,Czapka dar słuchać pacjent siedemdziesiąt późno lipiec.
96b0b56b-24f5-4c91-8953-f826105e3ad1,03bd7104-f3d2-423f-ac20-37bea637e8ac,2023-06-17 00:00:00,2023-06-24 00:00:00,Plecy dar włosy dach ciemność.
e2dfda15-6c0c-4216-abe4-f7bedef5d632,37f8392e-5ac9-4bfc-acc8-4f5d2447287f,2023-04-10 00:00:00,2023-04-18 00:00:00,Wartość alkoholowy wśród pokryć zwykle.
cdd608a6-0931-4ce3-8db3-87a660abc013,3f465fa1-7599-4072-84ac-d2b9696c89be,2023-07-06 00:00:00,2023-07-12 00:00:00,Pan góra nie ma złożyć szczęśliwy twój.
566a08c2-ff53-40b0-a2d3-400166f3429f,780e2148-0e09-47b4-a443-cfe92ab32aa5,2023-05-28 00:00:00,2023-05-29 00:00:00,Dodatkowy lata pomidor zakład samochód.
338c250e-55f9-42b7-949f-bce2be74b889,1cdab83c-b652-4699-bad0-31c285e6bee1,2024-05-05 00:00:00,2024-05-14 00:00:00,Symbol biedny sierpień w. poznać złoto.
551d0989-5df4-4ed4-93b5-9b66cd34bcdb,5fe16640-41d2-4f0c-998c-df8c5f998ec5,2024-05-03 00:00:00,2024-05-05 00:00:00,Obiekt bogactwo umiejętność wprowadzać proces bieg pieśń.
ff6206b5-fe91-4a83-9449-60750bef20e6,9029dc9e-139d-4e25-bc40-51b3152570a5,2024-03-14 00:00:00,2024-03-22 00:00:00,Wzrost ogół rasa uważać stopień w kształcie.
18d6f631-babd-47c4-9fed-82b3f4159bd7,ca33fca4-5052-4359-bf73-663ea6e4eef1,2024-09-16 00:00:00,2024-09-17 00:00:00,Komórka gdy określenie drugi różnica wyrób.
546ead15-0dee-484c-808a-6d0d18ab413e,179e2b18-25c7-40e0-b1dc-baf5f8f44bb8,2023-08-10 00:00:00,2023-08-18 00:00:00,Talerz mleko błąd obywatelka.
d44e31c4-9d99-4091-bbc1-b85ef04311ad,57579be0-f67b-4b3a-8bb1-2ff602747fb6,2024-05-09 00:00:00,2024-05-11 00:00:00,Typ określenie podział wynik rozmowa wyspa poruszać droga.
60a75724-a273-46b7-af8d-0d763a442085,718c484b-281d-48d8-bec7-43efb916e4b2,2024-04-27 00:00:00,2024-05-03 00:00:00,Przejaw małżeństwo dawny towarzystwo doprowadzić pojawiać się czynność.
679d01c6-931f-4b37-976b-2ecdbee67641,563eb58b-c0ca-465b-b3e6-0b841bd53b67,2023-09-05 00:00:00,2023-09-12 00:00:00,Padać dokładnie wino sukces zmarły rola.
c1f5aae9-ae91-45a2-bbf2-cec2f5bc3724,ea033a9d-f1af-41e4-9e20-1f36c6db58e0,2023-11-13 00:00:00,2023-11-20 00:00:00,Student mięsień Białoruś mur miara.
9210d3e0-9924-4a54-9542-7b17f37f2c27,851b51a7-6071-40d1-82f0-f67797db8ea7,2023-10-10 00:00:00,2023-10-12 00:00:00,Charakterystyczny przerwa telewizja zakon.
dd634470-ca74-4609-b3a8-ba29c9ddd031,a83c057a-4695-4073-90ca-415648202459,2023-05-29 00:00:00,2023-06-01 00:00:00,Pisarz gotować kobiecy odnosić się słowo.
0f629326-574f-47bf-b3ea-02d20f078ada,ee2133d4-9ee4-4e39-9104-8ba5f00fdd57,2023-06-11 00:00:00,2023-06-15 00:00:00,Opieka Morze Śródziemne liczyć pochodzenie banknot jadalny wewnątrz wspólny.
7d33cfa2-bacc-4785-80b9-453b4e969982,c43abec2-1baf-4340-9d0d-16603edac500,2024-03-28 00:00:00,2024-04-06 00:00:00,Przyjemny umieszczać deska.
5469070d-ba8b-4758-bd57-5116303ac3a3,bb143ca0-72a6-41f0-8cce-19671dbcc079,2024-03-01 00:00:00,2024-03-05 00:00:00,Widoczny mama powieść więcej koniec.
f726a68d-ca0d-46d0-a2f1-3e1c14829b34,1150bbbb-9fad-450d-b9c8-bd85f63b117d,2024-11-02 00:00:00,2024-11-03 00:00:00,Morze alfabet smak osobisty gwiazdozbiór.
0a91176d-a842-4b98-ae17-fe45a56a884a,e1515352-e4c3-4629-bb4b-3332b1d9e95c,2024-06-20 00:00:00,2024-06-29 00:00:00,Ludność trzymać aktor biuro klimat zwycięstwo stać złoty.
aa71ad2b-effb-41ee-b4f7-2abec2b2cc21,34a89507-7118-45a9-b67d-208f19777df8,2024-11-01 00:00:00,2024-11-08 00:00:00,Pismo porządek poważny te teren Indie stawać się.
83daa55b-ee1a-4582-805c-b7b026d710dc,e3e9c02a-09b4-448b-ba88-98771d17eff5,2023-09-13 00:00:00,2023-09-17 00:00:00,My ponieważ dopiero lecz wejście znosić hasło.
3a284cad-d1de-4ceb-b0c5-4ff02f9fc30b,06ae6aaa-04d4-41d7-8fc6-90e5ba86c80f,2024-06-07 00:00:00,2024-06-13 00:00:00,Naczynie krzyż bać się w. administracyjny bogaty.
ab0fa3be-94c1-4eac-a574-fd782b98a726,9aa995d5-061f-4661-9048-1ad6f0cc7ab1,2023-05-27 00:00:00,2023-05-29 00:00:00,Odbywać Się Dania dostać obrona wreszcie zamek słuchać.
d2e71572-f0b2-418e-b251-9a992de07b68,abbc956f-0b7a-4146-bda6-2b6b13b65108,2024-01-23 00:00:00,2024-02-02 00:00:00,Pięć zdrowie uprawiać stowarzyszenie siebie stanowić wysoko.
848b3152-5f1f-4830-b985-937128b9e959,6900c1e3-94ad-488a-8e5b-6c19203d74fc,2023-11-04 00:00:00,2023-11-09 00:00:00,Doprowadzić duży dziki wiedza.
fa834b57-337b-4213-ad10-f5af740d3e92,588d66f9-e1ae-4df6-89ba-99e0892eae37,2023-07-25 00:00:00,2023-07-26 00:00:00,Obejmować szkoła wobec rozwój 90 klasa.
09f61015-2b3b-416b-b75d-8c981e0d5f3b,30174f6b-126b-4f1b-881d-90df0343b907,2023-01-22 00:00:00,2023-01-29 00:00:00,Wisieć chociaż moment program.
542aeaad-7c5e-4b57-8d7e-2bb013495f0b,819fb065-7d58-498d-a49a-497a2636854b,2023-02-17 00:00:00,2023-02-25 00:00:00,Ameryka nadzieja cena różnica robić dalej.
721db5da-4ff3-4259-8d01-8fd304e7059e,42bf0650-cd48-40fc-853b-65a487337931,2024-10-23 00:00:00,2024-11-02 00:00:00,Bogini pozbawić w kształcie padać liczny.
61e91ade-a851-49af-8676-79ee5d749e40,cf17250d-8d67-4300-9645-2a109086ffd1,2023-10-29 00:00:00,2023-11-05 00:00:00,Wymagać rezultat bułgarski.
fa7e24a8-14b5-47b8-a5ed-b39f81ecf35b,75169e28-0d5b-4dc8-b645-90578a2ebf3b,2024-06-13 00:00:00,2024-06-16 00:00:00,Na Zewnątrz orzeł piasek stopień delikatny kilometr.
6ccb829c-6572-4d08-ba2f-3526d54a8166,74adc843-60f2-48b8-a35c-bf1cc80da458,2023-09-15 00:00:00,2023-09-20 00:00:00,Tył rozpocząć służba pierś.
a4bd9962-eacf-4959-bb71-b889caa436ce,c73cc139-4798-475a-9cb8-b2eb7875c41b,2024-01-10 00:00:00,2024-01-17 00:00:00,50 tajemnica jabłko gałąź.
f9686cc8-5496-4454-a17c-43b596973847,08654e18-6155-42e6-99a1-4d5c15c57dd4,2024-04-26 00:00:00,2024-04-29 00:00:00,Białoruś studia kawałek specjalista fragment to bieg.
667bf8c0-3fa1-484f-9fe8-c1de16e777df,796f0d85-ee3a-42f5-a4a8-aaabc983841b,2023-01-27 00:00:00,2023-01-31 00:00:00,Towarzystwo srebro polski stan katolicki.
463fd02a-10b9-416e-ba7f-de8ef9ae2149,9a711df8-4dc4-40ba-8e97-f9385c12f3f3,2024-03-26 00:00:00,2024-03-28 00:00:00,Radiowy go rzeczownik.
402920a1-5b10-483c-a8e2-221f253711b0,a6be1422-66a4-4d34-8b44-4210fe308d11,2023-04-23 00:00:00,2023-04-29 00:00:00,Wóz ochrona dar niezwykły.
5952a93d-34fb-401d-af0e-ec71034d61fe,9046df49-2a0c-42a3-9124-925244609831,2023-04-11 00:00:00,2023-04-14 00:00:00,Stary podłoga czerwiec nieszczęście element urodzić się człowiek katastrofa.
f7e96c34-d13f-4c16-92be-075bfb95cdda,0fbcd1a0-90cb-48f3-aa00-91926c5fb365,2024-01-08 00:00:00,2024-01-17 00:00:00,Król widzieć poniedziałek pytanie.
ae291bcd-50ba-4eb3-818d-b809db0dafbf,9582a99d-5c62-4474-918d-2c046c39f638,2024-02-18 00:00:00,2024-02-22 00:00:00,Żeby złożyć Polska palić niszczyć Polak.
e89718f6-74dd-4c44-bf9f-d37a24cc8b07,3fd9959d-7ac9-49d4-ac03-6a52458f08da,2023-05-27 00:00:00,2023-06-03 00:00:00,4 blady długi samochód dobrze dopływ.
7ede6e13-1ba2-4f2d-8013-56aac2b91ea7,3d0d3f22-a0ee-4f01-bbee-d9610cae1ff4,2024-10-12 00:00:00,2024-10-14 00:00:00,Duński Hiszpania dorosły stawać się międzynarodowy dziura gniazdo.
873a0653-cece-4511-8c28-0728c9bfe5b6,6ae45578-e9c7-4da5-b9f6-bc55ee93150d,2024-05-24 00:00:00,2024-05-28 00:00:00,60 wczesny warstwa podnieść cienki toponim białoruski.
31520530-d79e-454f-a923-8bc16f8ebf0c,c54625b4-8393-4e3f-b4a1-8cd40606a25a,2024-07-31 00:00:00,2024-08-06 00:00:00,Ciało majątek zarówno katastrofa koszt miasto przecież.
7a1323c8-b5f6-4be9-957f-3761bb9deef7,470c6e94-711f-4aa2-bc60-a91688f77dc0,2024-09-23 00:00:00,2024-09-30 00:00:00,Dno wywołać słaby samica gość gwiazda.
