id,return_id,issue_date,resolve_date,complaint
dc9d4724-eacc-4588-83b6-7897772901f6,ac2caef6-c595-4c78-9da3-b7d490ea2495,2024-02-03 00:00:00,2024-02-05 00:00:00,Linia odpowiedni oglądać Holandia pragnąć dzielnica.
6600663e-f38c-4785-8dd9-7cf62c2bbdf9,5b756739-6426-455c-b351-2db0964dcf24,2024-05-14 00:00:00,2024-05-18 00:00:00,Wybrzeże naj- powoli samiec.
9fbfb557-7c9f-4d94-b4de-0ebf0bf69c1a,0539f7c7-69d8-43a2-b234-674bb60a2d1e,2023-10-07 00:00:00,2023-10-10 00:00:00,Artykuł symbol koszula wyspa.
3e4ce374-04c1-4902-b85c-e23f8be60755,0b4ef130-9338-42a6-a42e-0f5bd9db3f88,2023-07-01 00:00:00,2023-07-09 00:00:00,Urządzenie serce plan zajmować się.
08d18b7b-62d7-4e8d-ac62-b90c82703242,e1e30f35-42f5-4644-b342-5970eebb21f0,2024-08-30 00:00:00,2024-09-06 00:00:00,Tor handlowy 9 szpital kość.
ab1326ad-93b2-4f03-9032-1c79c6ffa7b0,2dd67e91-d272-46ba-9c8a-c8e99c635602,2023-11-02 00:00:00,2023-11-08 00:00:00,Lista maj żyć przyjechać wzgórze dym posiadać kilometr.
dfd4c53d-3a91-4fd6-aa88-431ddccbf76b,cc967511-8a85-4bbd-8ed1-040181bf6ab4,2023-05-22 00:00:00,2023-05-25 00:00:00,Dorosły 7 sprzęt majuskuła diabeł ponad przestrzeń.
be4736e1-42a4-4e04-bec6-ca54025595ed,095e9239-7cdd-412a-80dd-ebeca02cadda,2023-12-21 00:00:00,2023-12-24 00:00:00,Kapelusz rozmawiać powieść wieś produkować.
353a5abe-1c5f-4e5f-a0c7-df71831ae45f,e130069b-ee50-411c-987d-dae8170cd6ea,2024-12-11 00:00:00,2024-12-21 00:00:00,Natychmiast słodki szpital wobec żołnierz maj mały.
7cd0709c-1e7a-4079-afdf-151c09d655d9,56d7e7bb-39b2-4ddb-b050-f8141b4a02bd,2024-05-24 00:00:00,2024-05-31 00:00:00,To marka gałąź.
18fc449c-0188-4fbf-8154-a44793e41098,3aa11c85-be5e-47a1-b560-8e3224533ad2,2023-02-28 00:00:00,2023-03-02 00:00:00,Historia członek poprzedni nasiono.
f9d6eb77-c5f1-4f63-960c-fc105590bc26,75a83688-8680-4883-a672-84f55db2910b,2024-04-02 00:00:00,2024-04-04 00:00:00,Funkcja dlaczego w. efekt dźwięk kura dziób poznać.
561e877c-5b86-4adc-94c1-256987aa0259,bedd78a5-9f81-4397-9cb1-f42c9219bf21,2023-07-13 00:00:00,2023-07-22 00:00:00,Instytucja przestrzeń religijny komórka.
dfc1cd3b-3b4c-4fae-a528-d54f0d86600e,e7cb09b8-ca16-4d3d-a85d-6d19edfa286b,2023-04-26 00:00:00,2023-05-03 00:00:00,Późny śmiać się wybitny oba pełen brzydki.
b669ffe7-d8c3-4c96-b322-3fe45f02cd35,2144812e-3600-4e6d-9d0c-7cb0e982f0b9,2024-07-25 00:00:00,2024-07-29 00:00:00,Otwierać m.in. ci ząb grzech dany klub.
0b028a28-68b4-4e13-88c2-2a7d952cbeb6,8c01be39-519b-4c0a-801f-aee40606b88f,2024-07-17 00:00:00,2024-07-27 00:00:00,7 przychodzić wyścig dziewiąty wstyd tytuł złoty zajmować.
144e68e7-1fdd-4821-9b49-92f9b8a4aaa9,56179b7b-1898-4ffd-a6b2-46875223dfe5,2023-08-14 00:00:00,2023-08-20 00:00:00,Ciecz stopa uczyć się.
168e6ae3-48a3-4adf-86a4-bc3d52288cca,64c4b154-f6e0-4b57-b04c-3d0c56a08fb3,2024-02-18 00:00:00,2024-02-21 00:00:00,Sześć farba położyć strata.
77ff013b-d20f-4fe3-9fc5-9193b40556a9,9f3f91d4-2bd0-458a-8ff0-a62a768a7b4e,2023-08-06 00:00:00,2023-08-09 00:00:00,Piętnaście Czechy bogactwo.
01dd08f9-bf9e-40ce-9a26-b791c50736db,ba080882-1d70-4e21-b3d3-836eac63581b,2024-01-19 00:00:00,2024-01-25 00:00:00,Zachowywać Się określony chodzić medycyna zaufanie jajko pracować.
2a37b59a-66ac-45de-add2-d02be5a6ccd8,015e31aa-6fc2-4eb0-bbbb-3fa0d8a1faef,2024-07-03 00:00:00,2024-07-09 00:00:00,Miły dać się długi krzyż.
211f913e-6465-4477-af85-aa84271d023a,f0655734-e0bc-4c3b-861a-8bfccfbb29fd,2023-02-12 00:00:00,2023-02-17 00:00:00,Stracić szukać zdrowy godność upadek ?.
80857b32-5882-4f0f-8412-e61bcfa56936,f04f67cf-43b7-4532-8b3c-51f2079289ab,2023-09-22 00:00:00,2023-10-02 00:00:00,Skłonność pochodzić prostytutka bądź spadek wykonanie.
9792507d-0979-4c7e-bbbc-33c8315df579,add5d224-fee1-44f7-8dc6-4361a1eefb90,2024-06-06 00:00:00,2024-06-14 00:00:00,Wywołać teren ciepło nadawać.
cbad1cda-a7da-4cb7-b713-eb99ff43c4d0,4d990f66-6916-430e-889b-911af42f7da8,2023-09-30 00:00:00,2023-10-06 00:00:00,Zdolny Europa wiedza głupiec dziadek obejmować bilet.
9942d3fa-d955-4c85-b03c-12da18583f83,f7d35916-c4c3-4052-a52c-497fe8869575,2024-10-15 00:00:00,2024-10-23 00:00:00,Ciecz pasmo uderzyć mur grunt muzeum.
bc01a4ee-3094-40a5-8447-42dfdfaaeed1,c4a285f0-1054-4fe4-b300-faf0cd977c25,2023-10-10 00:00:00,2023-10-17 00:00:00,Telefon biec statek.
b176c0d4-5c48-4eea-921e-95dffdcdc824,4019ced2-6d3c-4102-b6da-c6962e6a0edb,2023-01-31 00:00:00,2023-02-07 00:00:00,Wrażenie sklep szacunek 1 mi czwartek jajko.
0abd3377-86e0-4cbb-bd9c-0a3869a345b7,f0d8878d-c704-4236-93ef-78d2d8d9a399,2024-11-01 00:00:00,2024-11-07 00:00:00,Graniczyć wybitny drobny męski jedynie.
c42d37d3-eb26-400c-acd8-65f59b88638a,bdaa049d-ac7c-45da-a307-45e8d6262188,2024-01-10 00:00:00,2024-01-15 00:00:00,Relacja światło szukać wnętrze zwrot tłum.
a5b88163-8bc5-468a-a1d8-327569610af5,dfe220f9-127a-4f2a-a3a0-d169a536789b,2023-11-26 00:00:00,2023-11-28 00:00:00,Pić uniwersytet podłoga moralny obóz stosunek.
81bcb750-c248-4cc9-8d1d-e35be35a6a62,e78a9005-0b80-4522-86cf-126a2ea41c7b,2024-06-11 00:00:00,2024-06-12 00:00:00,Współczesny głowa studia.
3be9cfcc-5aaf-4bf8-b866-f791f31ae33f,1131a137-9832-43d7-9ed2-6e3a982325c1,2024-12-20 00:00:00,2024-12-28 00:00:00,Doprowadzić pijany 30 bogaty los.
6d7a5f23-8b86-4d68-844d-976961b8e6c1,84560639-9e32-47f0-ac5d-584d64f0e1fe,2024-08-30 00:00:00,2024-09-05 00:00:00,Gotować przygotować liść przepis lubić uśmiech.
1fc95ca5-387f-4a18-9b21-e57fab909cba,c122da9a-86b4-4dee-a64a-3a85375c23dd,2024-03-27 00:00:00,2024-03-29 00:00:00,Gość ta dziewczynka strata Kraków usta.
6a7f9cea-c594-4c4a-ab42-c37dcfa024f1,f36560a5-2c2b-4c02-918a-07188bd6c3ec,2024-12-12 00:00:00,2024-12-22 00:00:00,Pół oznaczać drewno mur.
6bb5c698-84d4-4a6b-bc23-347f87216a04,74274295-98d1-4821-8a85-3cde2e6d0d2e,2023-03-03 00:00:00,2023-03-10 00:00:00,Alfabet struktura autobus córka.
4c6fa720-8a27-4349-8eeb-e805866a7f52,d165cbe1-fc1d-4f54-8038-607c947687b8,2024-04-05 00:00:00,2024-04-13 00:00:00,Dwadzieścia pół sukces prezent instytucja żaden.
17c49961-a19c-4539-8e90-2ed5fce8bf09,1449381a-81ef-423a-9205-1e406d3534f8,2023-10-08 00:00:00,2023-10-16 00:00:00,Składać Się Polak most spadać Słońce wynik.
5e8eb61f-faba-4e8d-a3cb-2ec35352a46d,5ddc8816-ad86-42c2-9ae9-9271db7e3825,2023-03-21 00:00:00,2023-03-31 00:00:00,Policjant dużo mleko dokument wilk nieprzyjemny kara.
2301181c-dfdc-45fc-8e1e-2e371885920d,e4d27a49-6c32-4076-b32b-343809ddc233,2024-07-01 00:00:00,2024-07-03 00:00:00,Pewny krowa śnieg złoty wy.
f586d60d-f0e4-42b1-9d05-4d2f0d82d028,7d39a263-ccbc-46ee-9cee-3bcdb6b4c472,2024-02-07 00:00:00,2024-02-10 00:00:00,Przepis oznaczać wiosna energia nagle sierpień Szwecja.
f3927e41-4053-404d-b435-16ade8a7bcaa,7cbb1df7-17a1-4296-8f5e-fad1916d8dc9,2024-10-28 00:00:00,2024-10-30 00:00:00,Srebrny nos miara ogon sport dość te.
8dbd5e73-2ea6-4722-a72b-326eee527783,4a4086bb-eb65-4380-a5f7-7a36eb7f4d00,2024-01-04 00:00:00,2024-01-09 00:00:00,Stacja minuta podać masło wejście zabić autobus.
4ef1e1af-2f73-46fe-bfad-cf0c3d6e6159,4bffb9d0-122d-4324-8068-43caf5c8cd80,2023-10-02 00:00:00,2023-10-03 00:00:00,Łóżko minuskuła służyć inny silnik Piotr nadawać.
448eaa3f-74e1-4bf6-8106-f15ab30ce051,21884c52-b084-454e-a457-b7f2c46f9662,2024-06-26 00:00:00,2024-07-05 00:00:00,Prawo nagły budować wnętrze koza.
455f6023-697f-471e-9ee4-c11a7436a516,ad0d802b-dc57-4c82-bd3a-3836e4aaaeef,2024-12-15 00:00:00,2024-12-25 00:00:00,Nos Unia Europejska więc metal wujek siedzieć płaszcz wejść.
8a0a1e32-b5d2-41c6-8647-5ea2c124715c,e359917a-6675-4175-8cca-3b6b947aaf53,2023-11-27 00:00:00,2023-12-03 00:00:00,Kwiecień zabawa gleba stopa gdzie otoczenie.
3a7c76b8-56e1-4075-a335-0a005a4bfccd,7ba52506-3e24-4cad-bfc2-f0cede4ae2f5,2023-12-18 00:00:00,2023-12-28 00:00:00,Brać gotowy jakość seks pies ćwiczenie.
f90af7ba-516a-4032-8f71-bdd7360e4099,3197c1fe-0b85-4477-acfd-5a3293df2802,2024-07-16 00:00:00,2024-07-23 00:00:00,Otwierać mieszkać gdy rząd sportowy.
98a9e639-70ec-4689-b231-96ea12aa18bb,495189b3-fa47-44d6-b58a-d1e16ad529e8,2024-11-19 00:00:00,2024-11-26 00:00:00,Wszyscy towar kłaść istnieć prosty naród brzuch wracać.
3a2fdea0-0e8c-4575-89a9-12d9a450676a,446676f6-9152-4fb5-a60c-af6c9ce72818,2023-12-06 00:00:00,2023-12-16 00:00:00,Organizacja i dobry przyjaciel zanim.
96aa3173-bf6a-4db8-9bb7-fca0bcb3457e,9e23f649-190e-4283-9395-e88a69b7ade9,2024-05-22 00:00:00,2024-05-24 00:00:00,Zawartość policzek pragnienie drapieżny pomidor szczęśliwy nauczyciel ser.
36450af1-c012-41a2-9978-658ecbf36f94,0932392c-3250-4c5a-8494-2448fadfbc77,2023-06-19 00:00:00,2023-06-21 00:00:00,Złoty hiszpański oddać trzydziesty szanowny przyrząd łagodny.
f790e195-8c2c-4f33-bd0c-bc77a7bc2b2c,998b8aae-fa11-4330-9d34-61962b966953,2023-09-26 00:00:00,2023-10-03 00:00:00,Budować 9 potrzeba gałąź.
777503a6-aca0-4102-a934-9589677f5261,6d321ac9-5259-4516-806f-a7a10e014b1f,2023-07-23 00:00:00,2023-07-29 00:00:00,I azjatycki piasek wóz prosty.
c9ec0bbc-4a0f-48c2-9fa8-25e0612a1d83,3916b361-4869-4860-8b7a-9e05198a73d5,2023-06-17 00:00:00,2023-06-22 00:00:00,Położyć — ciepły Morze Śródziemne.
95f6d4cb-a199-44a4-98fe-6ad21fec1dc8,9251ffd0-ecf9-4f90-aa8a-f78bb3b4bac0,2024-06-15 00:00:00,2024-06-17 00:00:00,Ślad spotkać całkowicie Francja kto pamiętać powinien.
82157ce9-fe45-445c-9557-a3119d7c1bdb,79c2f662-b412-44b5-8f61-6db6a13d59ed,2024-12-20 00:00:00,2024-12-26 00:00:00,Znowu dwa temperatura zaraz granica przynieść w formie.
b009a36b-a3b2-4fdb-b9f2-73e2b01ec1af,e0913830-c092-464f-8cd6-d7479f724336,2024-03-18 00:00:00,2024-03-21 00:00:00,Młody dziadek wczoraj ogień godność matematyka.
0e0ddfba-4ac1-473d-bdf1-d67b508efde3,2d2e889b-e0bd-45e6-a313-ca2623daf36f,2024-12-09 00:00:00,2024-12-12 00:00:00,Obchodzić minuskuła rada informacja nadmierny.
06ceb3b8-b60f-48cd-832d-893040a6c628,3c7b3735-46a8-46f7-8167-e90007ed9c69,2024-06-09 00:00:00,2024-06-10 00:00:00,Nasienie cecha w końcu ludzki wódka szwedzki.
cd6109a1-591c-4adb-9b3c-8f54b79d142d,d8ac38e1-adda-4a06-a5f8-12d56d01e3b1,2023-05-15 00:00:00,2023-05-20 00:00:00,Skład zimny gleba układ żółty ciągle.
956b2ea4-4184-48a2-bf27-d34b4a8f6f97,048b9af8-b497-4a62-aab3-e9c99b7b9c63,2023-07-07 00:00:00,2023-07-14 00:00:00,Impreza iść rachunek do szkolny.
6f28d887-ab83-4041-89f0-f23ea20b56cf,d5b7460e-cc94-4df9-8766-01cdbaacd2f4,2023-10-18 00:00:00,2023-10-26 00:00:00,Wilk zajmować wesoły mi pisanie nocny czwartek zamiar.
9e893e28-25eb-4fa1-aadf-cb8f6e4746c7,0fca4e5c-0fd4-4388-a980-5c5f74cf0860,2024-01-06 00:00:00,2024-01-15 00:00:00,Most zdobyć pałac.
5b5a2030-8375-4e45-8cfe-8cd35b92aafe,3456fc87-f7fd-474f-b2bb-bcc561943434,2024-04-16 00:00:00,2024-04-22 00:00:00,Przedstawiciel szklanka zdolność społeczeństwo.
7bd0083a-d7a8-4135-945e-e97eb67d101b,790de5ad-fe44-4ebb-ab1a-1adf2917b4d5,2023-11-28 00:00:00,2023-12-05 00:00:00,Alfabet zdjęcie administracyjny kto wakacje rodzinny przyszły.
9f57c604-4f97-4650-bd02-1ff0b17c8efb,12415842-690a-43ae-a547-e143a07af387,2024-02-15 00:00:00,2024-02-23 00:00:00,Klasztor ciąża wielkość nauka.
7b743e55-184b-47dc-a678-c589598743d1,05a8fa64-69ea-4286-9a94-1028e4dad913,2023-08-23 00:00:00,2023-08-25 00:00:00,Mocz majątek lista śniadanie pisanie rysunek.
4720c34a-b8de-4e4e-b48c-569f14448c21,e55e66c6-1235-49ed-9094-c58adf37db9b,2023-12-08 00:00:00,2023-12-11 00:00:00,80 różowy wódka.
21fd4d0b-fffb-430d-8639-35b5d8657a1d,9c972233-4f39-4605-a2f6-d23972cdd9e8,2024-03-07 00:00:00,2024-03-14 00:00:00,Zupa prezent żeński plama.
baf2ab4c-4b44-4365-a0b8-94196775dc93,df24c99d-89c8-4158-b80b-0a4177adb74c,2024-11-20 00:00:00,2024-11-23 00:00:00,Wielki instytucja Austria ciecz granica deszcz.
045a44dc-d38f-4454-b467-bbcc811c0c4f,80bb2b79-0752-47dc-a621-1e3ea5f9f308,2023-02-19 00:00:00,2023-02-22 00:00:00,Sam wyścig gatunek zamknąć pochodzić.
3cff7ef2-a18a-447f-99b6-4cb68558b63f,cdc14dee-2995-4506-9288-a55ac72bcbc1,2023-04-14 00:00:00,2023-04-18 00:00:00,Istota żołnierz toponim warunek dusza jej świecić.
cb003ebb-8279-4e7f-ae7a-7fb7045619de,1f6e95f1-35ec-46b3-b6d1-c0aa3362f5e4,2024-01-17 00:00:00,2024-01-21 00:00:00,Przedstawiciel teoria zmieniać wkrótce rząd jadalny otoczenie.
1514592b-8c6b-44b8-9b58-097a7fbae7b4,132fe5e5-8cb7-43db-8b11-4783f6526e8d,2023-04-11 00:00:00,2023-04-18 00:00:00,Sierpień powodować przyrząd zjeść podróżować.
18db8ade-bb50-47b3-9d43-f8b3360541e1,8796777a-ef49-4c1f-93f4-114efd5706bc,2024-02-06 00:00:00,2024-02-14 00:00:00,Tłum spaść czarny Azja temu budynek.
7c0c39a6-85b7-42c0-9002-a1878b931dc2,5dd1fd14-26d3-412c-933e-c65d5d0e1452,2023-04-23 00:00:00,2023-04-24 00:00:00,Włożyć nauczycielka znaleźć literatura.
b0ec5e33-0ef7-4118-bd18-0698146dc0a0,94913306-1d10-4cf2-8b2d-f57e34172088,2024-07-29 00:00:00,2024-08-08 00:00:00,Jedyny sześćdziesiąt w końcu pragnienie coś system.
155f2658-727d-4b86-a1cb-936d1f5b539e,f126de92-3804-4e6e-ade2-e7515289bab6,2023-12-11 00:00:00,2023-12-17 00:00:00,Siła ziarno nowy grzyb Chrystus klasztor wódka.
76178e37-ccfb-4d8d-a667-d399e47162d1,3843389a-47c5-4d8c-8164-2db43534411e,2024-09-07 00:00:00,2024-09-17 00:00:00,Wojsko lampa spokój słowacki.
3659ce90-2b0b-4e10-ae81-3ea0499d0eb1,92601f49-e645-458c-9717-7500460f275a,2024-04-03 00:00:00,2024-04-10 00:00:00,Tytoń pasek bogini owad odcinek.
1b937e17-7c2e-44ee-a435-a1ca3896d486,4db1cc66-f7bc-4da0-aa84-5e7d7fee117b,2023-05-13 00:00:00,2023-05-23 00:00:00,Produkcja dokonywać łączyć partia wreszcie przedstawiciel sok.
192993bc-455c-4409-808f-aaa1f5344657,c4b35017-d6fb-4f6a-96c1-5d502b650d2b,2023-06-27 00:00:00,2023-07-05 00:00:00,Towarzystwo pojechać modlitwa jeśli ślad miękki chrześcijaństwo.
62eca185-8370-495b-bbda-1426c69202d9,7b9e9fe6-aa96-4b16-8f95-9a0c99eaf9bd,2023-05-23 00:00:00,2023-05-25 00:00:00,Służba dzień wielki poza Słowacja czasem nowy.
41e12087-dda9-48be-8fe7-14b1209e46e3,407771a8-1dd6-4685-b32d-80d7f6212cee,2023-10-28 00:00:00,2023-11-03 00:00:00,Sprawa forma pięć sobota.
83cdc8e3-d1f7-4ca1-8a8c-afe646913901,a7d3c901-0cc8-4513-adc2-e3bcef7e6bd4,2023-10-15 00:00:00,2023-10-23 00:00:00,Żelazo mieszkaniec składać pieniądz ubranie.
d4ce266f-2022-45e0-b47e-c73bc1cab488,2e81832f-d433-44d5-aa76-dbd3f6fe1143,2023-11-30 00:00:00,2023-12-10 00:00:00,Połączenie narząd ja.
9fa9c4e4-ac74-4f3d-9ff0-c09559d64a52,86e1ea7a-0be0-4c71-92f4-4a143705cc26,2024-12-14 00:00:00,2024-12-20 00:00:00,Zasada różnica czerwony krzyż pamiętać cichy drogi minuta.
63b73c2b-8f39-4fce-8d1e-2d91edc8b308,324c506e-6239-4f61-8567-f4f8de8d2905,2023-10-11 00:00:00,2023-10-18 00:00:00,Dym wszelki dwanaście deszcz luty.
60030a88-4796-4311-b6c0-3740987bd12e,0ce648b5-5820-4cef-ad5c-cf94c6d6648f,2024-02-23 00:00:00,2024-02-29 00:00:00,Danie policja klasa dokonać rozmawiać myśl bawić się.
c2718191-137d-496d-8e6a-85c72665156b,b3117fb4-ed9c-4ffd-875a-632d46ad0fda,2024-01-17 00:00:00,2024-01-22 00:00:00,Udać Się wśród drugi autobus napisać.
3794336a-247b-4a69-898c-4e44f3f8793b,5c832d25-01b9-4297-a288-e1eb3ce639e0,2023-05-17 00:00:00,2023-05-26 00:00:00,Pomoc tor zmiana widok myśl impreza dzisiejszy.
85ad1b14-dbb9-45d7-a0e0-d963b603a729,8ec83aaa-6773-4c32-b5c5-c3ec36e4b52d,2023-10-07 00:00:00,2023-10-11 00:00:00,Gdy dolny latać układ przedsiębiorstwo ochrona szklanka głośny.
5574aaa5-4a3b-42c6-8916-ee052868727a,56b6a19d-37ba-4f4d-bc63-4ca7f2139fa9,2024-11-14 00:00:00,2024-11-24 00:00:00,Kostka nie określać opuścić straszny.
84dba8aa-96ae-4e0b-a0eb-9f9932613dad,8c33dd21-dd11-4fb3-8e9c-8a2f1e487167,2024-04-27 00:00:00,2024-05-03 00:00:00,Pamiętać przyrząd tłuszcz zamknąć samica narodowość wiele.
da8b65c4-b7f6-4fb6-9d73-6231b2df6e77,c865d957-75c5-4d9c-8484-6e4ead77d2bf,2024-04-11 00:00:00,2024-04-13 00:00:00,Pierwiastek poruszać się mięso bieg czoło trwać próba pochodzić.
3772e61e-8f0a-4c37-b248-c802a98e4cc2,def08b39-77ad-4ccf-9e1f-8509b76aaaed,2023-07-03 00:00:00,2023-07-04 00:00:00,Przedmiot fala poeta obecnie.
39a10d14-15a6-46ca-bfc6-04ef164dd212,8d1d003a-8719-4132-9f5f-165200580469,2023-06-07 00:00:00,2023-06-16 00:00:00,Kawa wino podobny strumień wyjść.
a462810b-b72a-41da-8d6f-33cf2b1860a4,ab2ac3be-c636-4582-85f4-bd4195427f99,2023-04-08 00:00:00,2023-04-09 00:00:00,Produkcja wysokość pogląd panować natychmiast.
ff25a6bd-6284-47b8-a892-11ed8597f54c,7aaf9a8b-97f8-4280-87b6-4aaaac7662de,2023-11-23 00:00:00,2023-12-02 00:00:00,Głód jakość twardy ziarno trzydziesty całość żaden.
78425244-219c-45e8-84e7-76a3309a0c81,5b111130-7d19-427f-9816-a9a83f0bdd8e,2023-09-06 00:00:00,2023-09-08 00:00:00,Osioł ciepło rezultat zielony kolej.
ed53c9ac-6f4d-421f-a77e-d8aec8b0c5b3,f6db6b26-aba6-4af3-b3a0-674a0f9c27ab,2023-02-10 00:00:00,2023-02-16 00:00:00,Słowacja kaczka jechać imię.
fa08249a-b7b5-4fd8-9bb9-8891ce8bf3b3,3fa11fe4-89ac-4114-b158-7cf3ea79f432,2023-09-26 00:00:00,2023-09-29 00:00:00,Ryzyko stół wiek żywność ziemniak podnieść.
e8652fbf-902d-4b9b-8c1b-4381d2d07ba4,f3aee792-5137-4872-b929-09d381db6f60,2023-06-01 00:00:00,2023-06-06 00:00:00,Spadać głowa nauczyciel długi spotkanie literatura poważny.
7e6ac4ee-c994-482a-b475-27f404b4d1bd,ae8e9393-cea2-4b30-9a39-f5e8d8910fd9,2023-04-02 00:00:00,2023-04-04 00:00:00,Kurs pora swój oni USA żaden trzeba.
fcf42525-2bdb-430e-8933-3f6558f224fe,ca366535-5c34-4cae-a9e2-5a9ff325fb99,2023-05-01 00:00:00,2023-05-07 00:00:00,Stół wszelki założyć elektryczny zamieszkiwać.
8860b52c-9d9b-4aae-8e7b-00717cc0935c,a1577a69-73ea-421e-add7-c9a88c154dc0,2023-10-04 00:00:00,2023-10-08 00:00:00,Temu relacja sól specjalny wkrótce prąd one ty.
bdafd7a4-8cd7-4940-8153-1a72b4dd8d64,d7a7cd7f-64c1-4e1f-9da1-f5656a3915af,2023-01-14 00:00:00,2023-01-24 00:00:00,Leżeć korona moc słoneczny.
89838930-6e37-4d15-bd72-0a41e30fcbec,c7c9888f-926b-4494-9f86-edf3a0f2b478,2024-09-07 00:00:00,2024-09-14 00:00:00,Powszechny znajdować się nawet szczególnie metal.
b34ae2cb-0fcc-4023-8892-2d09a35780fe,58cb97a4-765e-499f-90d0-1f4ec964b52b,2023-04-18 00:00:00,2023-04-28 00:00:00,Każdy popularny papież typowy.
eaba1fe8-48f4-43c1-8ee6-d8d977624e9e,2aa6f72d-ec9c-4951-9165-17c4701657c6,2023-08-08 00:00:00,2023-08-18 00:00:00,Wyglądać warunek wciąż dużo dom.
05b7ae88-2178-4c08-94d1-2fd2505d6cf9,2e08eec9-8af9-4fcb-a959-e8c09fe9152b,2024-04-14 00:00:00,2024-04-21 00:00:00,Jazda pasmo służba wrogi potrzeba woda ślub.
d9f8b744-d7c4-4a69-afbb-d79907e6afc7,600c7b7d-90a2-4a57-b40b-233b903eab12,2024-09-07 00:00:00,2024-09-09 00:00:00,Chiny cecha seks.
17d157d7-93f3-401d-b445-3c770d4f31f4,e7351e74-102e-460a-9539-fa05f7fc159a,2024-12-06 00:00:00,2024-12-12 00:00:00,Środkowy następny różowy znaleźć trwać słowacki.
2ff5ba49-1534-4764-a300-669a2df88cbc,27d58703-c3a3-4856-bf42-6a4b08b4e820,2024-01-12 00:00:00,2024-01-21 00:00:00,Sobą narkotyk delikatny spodnie.
fb8af561-d80c-4a11-a87a-5156d92b39d3,79e961ef-5c6d-4fe1-875f-cea2d2024d42,2024-10-28 00:00:00,2024-11-02 00:00:00,Wolność ludzki daleko płacić Włochy uciekać.
7102791e-856b-4645-acde-254eefe42a3a,ab5e6ba6-b544-4f3f-93c7-a2e96cfbb114,2023-04-09 00:00:00,2023-04-17 00:00:00,Już zakończenie kierunek robotnik.
42b87b37-3306-4f29-9ead-ed69e996e0a6,76c8f59a-acf7-41a1-83b9-f250a60f8fef,2023-12-10 00:00:00,2023-12-19 00:00:00,Pomidor wierny w kształcie świątynia kilka wygląd styczeń.
a84ad485-5244-4d53-9d68-3f4fed0cdd73,475d99e2-3884-4b3c-ac06-e2dc79f342cd,2024-11-14 00:00:00,2024-11-22 00:00:00,Liczba sport główny bank bądź mój.
13f26587-0cd2-433f-95ae-a24b8dc8dbf9,863960b3-f2f6-4b60-bf14-4c079e84bd54,2023-12-31 00:00:00,2024-01-08 00:00:00,Nigdy przeprowadzać wykonać morski cztery uczyć się.
b8c3ab40-1830-4d3d-810f-fad1ac71f395,9806cc63-cf30-47e6-a12e-4f04f9670a17,2023-08-20 00:00:00,2023-08-24 00:00:00,Złodziej jądro swój deska wskazywać cesarz.
3b26f6a3-65fe-412b-b206-8e5cf5b27778,2bf7fddb-9601-43a8-a25d-933e8b02bcc9,2023-06-02 00:00:00,2023-06-03 00:00:00,Syn wycieczka sobą mebel zacząć dolina temperatura śpiewać.
87a87a99-8307-418d-9d6c-694c0461fe32,561900c1-1a22-433a-a8c4-346e25c63407,2024-10-10 00:00:00,2024-10-11 00:00:00,Dopiero żaba zdarzenie nauka.
7e5b1c13-73b2-4150-811b-5951e34b61a8,7cbc3f6d-c75a-456c-ba44-2a07e83273dd,2023-03-10 00:00:00,2023-03-13 00:00:00,Powinien forma pojechać dział.
9dc8fcc9-39d4-4bbd-a080-d86066043924,a2948e62-dcd9-4d98-bebc-e59681c49c42,2024-02-16 00:00:00,2024-02-21 00:00:00,Zakładać powiat parlament.
3c0ff9ce-84aa-4ea7-afc6-2d5d2d8e0947,46384e8d-d472-4f44-8ea9-d92efc725195,2024-11-01 00:00:00,2024-11-06 00:00:00,Tor wielki przyjaciel — sto zachód odbywać się chiński.
3e9b218a-e496-47f1-9e92-5ef6bb5290e2,efe6abe5-f80c-4343-bc8c-350e88506e65,2023-02-19 00:00:00,2023-02-21 00:00:00,Bać Się spadać trzeci miara literatura.
a367b742-2733-487a-bcb6-39812b228dbe,b3a01ec7-61bf-46cc-b062-3baa59523941,2023-12-12 00:00:00,2023-12-15 00:00:00,Szósty międzynarodowy społeczeństwo rezultat chrześcijański 80 słodki korzystać.
d003ed99-1fa1-4599-a8a1-e974bb03f233,1d9fd562-afe4-4738-87bc-e3ba0b35742c,2023-06-07 00:00:00,2023-06-15 00:00:00,Kochać wypadek każdy przyjechać.
50637ce1-8a67-4bdf-aa41-2e898dc0fb57,fd2b8efb-2f8c-4659-b3ef-a075b1f6dedc,2024-05-24 00:00:00,2024-05-30 00:00:00,Podróż kiedy napisać myśl drzwi -.
1ebf848e-23e3-4234-bb02-cdcfd9938150,c9147f9f-3131-4dfd-91ce-1206d4f0fe5e,2024-05-16 00:00:00,2024-05-25 00:00:00,Potrafić zachodni październik ozdobny można pozostawać niebo.
87a00b6d-d549-4696-bbf7-3cd6058b4ccd,bd721992-83e4-4e41-a4d5-fac8a7fc5d06,2023-11-04 00:00:00,2023-11-10 00:00:00,Przeciwko różnica nosić słyszeć zbudować zajmować się już.
02da7169-f7e9-4dd0-9092-17cdf81bbe38,a0b26c45-2eb4-42d6-9f86-10daf84eb3be,2024-04-04 00:00:00,2024-04-14 00:00:00,Francja długo trudność wykonywać.
1f8f9ca1-eea0-4396-b178-23b081defd62,7cfc51ee-2cc9-49b2-9851-9f54811b7b60,2023-07-27 00:00:00,2023-08-01 00:00:00,Wypowiedź samolot wybory tamten przestrzeń wykonać wojna.
067fc819-b8e1-417a-9b1d-543e56c886d9,c1b6475a-21fd-47c8-8c1c-184df6096d5f,2023-03-07 00:00:00,2023-03-16 00:00:00,Dziki epoka pieniądze rasa cierpienie nadawać pochodzenie.
87847ff1-294f-43f8-a840-6902bebf458a,3ac05005-83b7-4d66-ab4a-16d9b3afd299,2023-04-01 00:00:00,2023-04-11 00:00:00,Wybrzeże matka gaz atak.
275df393-81fe-4d5b-b470-4728a6a2759e,6b5bb8d8-78ec-49db-aa81-10ad426a090b,2024-11-10 00:00:00,2024-11-11 00:00:00,Wskazywać pustynia pochodzić długość zamykać typowy modlitwa.
8199b142-38bf-40b0-adad-1a4a08474af3,ccf7a540-7b30-475e-a370-7e2f848c1a1b,2024-05-18 00:00:00,2024-05-23 00:00:00,Dobrze publiczny położyć dzieło czyn klub rok zamiast.
a6b57da0-7883-499d-93ce-aec7e6ce589a,035f63a0-bbb8-4280-ba65-daaa112dcf74,2024-06-20 00:00:00,2024-06-25 00:00:00,But pojechać tutaj sobota kosztować ktoś lek.
20262a7e-e3f3-4776-9b77-15a0e2e93c03,cab7b94a-9cdc-48dd-b8ad-0834791c6ae9,2024-08-18 00:00:00,2024-08-28 00:00:00,Jaki kolej 50 późno przedsiębiorstwo płeć prostytutka wyrok.
33a7d984-ba79-4063-a783-e6c99e1e12c0,c6503cb2-f015-46d0-9551-bd5b60c44b8a,2024-09-21 00:00:00,2024-09-27 00:00:00,Osioł talerz tyle.
b47e2b7f-c5fd-428e-920d-78a965df1073,2bc5bb53-8e61-44d0-a426-20e89d1d05bb,2024-10-27 00:00:00,2024-11-02 00:00:00,Podatek Afganistan firma.
186cd3a7-9651-470d-9800-d6b4ca9aab32,00c7b405-3c99-4f1e-b2f0-7a09e2a0fb49,2023-01-11 00:00:00,2023-01-14 00:00:00,Zamiast wobec Pan wzdłuż suma.
9fb85e0a-31a5-41e9-b1e5-7b5f46ab54c8,218e8f0b-68d6-449c-8874-3d9b61efcd42,2024-09-08 00:00:00,2024-09-11 00:00:00,Mieć prasa obejmować umożliwiać.
362ccbf6-f685-47b0-a7a6-de7666a7395c,d19caeca-2a24-437a-9ed1-72875ebcfc22,2024-03-29 00:00:00,2024-04-06 00:00:00,Miasto dialekt przyjaciel lekki Ukraina przygotować.
a48d452a-6780-47a0-b8f0-513f6475d930,4054fdb1-c512-45d8-ad20-4085577bee47,2024-01-02 00:00:00,2024-01-10 00:00:00,Jeden wiedza sukienka.
2b745659-0aa3-4741-ada3-e2ab62ae798b,1dace135-4f49-45af-8f24-dc18124f34f9,2023-12-13 00:00:00,2023-12-22 00:00:00,Europejski dobrze kraina udać się czytać dodawać.
fb35cae7-87fd-46ba-9444-a745dd5ca9cb,d55601c2-2425-47d7-a36b-3a508430aa99,2023-06-18 00:00:00,2023-06-28 00:00:00,Statek autor wieża klub.
a0e9a22b-dfe5-4db6-bba6-5b304aef95f9,df20b94e-18bf-48df-a376-7f43c369ac80,2024-03-14 00:00:00,2024-03-21 00:00:00,Podobny tajemnica zawodowy złodziej pełen niektóry fragment.
f60d9e54-c343-4238-8431-ffba346020e9,003ebf2a-75d5-4c7c-8402-17a49ff31929,2023-09-05 00:00:00,2023-09-06 00:00:00,Oś dziedzina natura ludzki kłaść.
914fe7a1-bbd2-476a-85bd-86b58cea78a2,24a2c8d4-a6a1-4c73-be8e-f6b796576b18,2024-11-29 00:00:00,2024-12-01 00:00:00,Cichy określać zdobyć.
17d21b4e-ad3d-41dd-9e4c-3b4026571a54,888b6860-cc09-47c1-818c-58c5e9c06390,2024-09-21 00:00:00,2024-09-28 00:00:00,Mebel ogień początek królestwo.
3d7b8262-7663-492c-8731-584c94d43afe,ab74484a-478b-4c93-aa68-0607a7f0603f,2024-05-29 00:00:00,2024-06-06 00:00:00,Jajo szeroki dziedzina pszczoła.
eaf3eeeb-7921-423d-9ecd-d00593fa2751,4bff6740-0ac3-4bd2-b17e-bea17d7c8eef,2024-08-09 00:00:00,2024-08-13 00:00:00,Proces wydawać się szacunek majuskuła restauracja by grób.
f1288a64-ed34-4f25-b747-6e9000affe47,7c5a28d7-ec89-421d-a054-6c286f05ec50,2024-11-22 00:00:00,2024-11-25 00:00:00,Narzędzie wtorek pochodzenie.
a5721dba-5615-4693-819e-056ee0e4d12f,fe4f836e-8c10-4caa-86ea-ddf98f7095d4,2024-03-04 00:00:00,2024-03-10 00:00:00,Świecić rodzaj ręka Włochy słoneczny skłonność wpaść.
ad5b1908-02b4-4a05-9c07-3db2caa61055,0fd15f6b-1bc4-451f-a1b5-f3436d305804,2023-10-06 00:00:00,2023-10-08 00:00:00,Tekst państwo umieścić w nadawać.
40a8ccf0-b39a-48a3-939e-d5cc65d0bccd,ec2e0651-0531-4e9a-a159-a6a4c18f2957,2024-09-03 00:00:00,2024-09-08 00:00:00,Próba błoto klucz głupi trzy czwarty kobieta.
e91e5ffc-48dc-4eed-ac64-7ca1114fbf4f,1edbfb2d-8983-4fe8-ae5d-6d4e54ba26e2,2024-10-22 00:00:00,2024-10-24 00:00:00,Kanał żołądek modlitwa port otoczenie.
