id,return_id,issue_date,resolve_date,complaint
a1786c4a-584e-4f2f-989a-341696791b36,53ed3d9a-daab-406a-a2b5-727ba268d933,2024-04-26 00:00:00,2024-05-06 00:00:00,Należy uzyskać pomarańcza minister.
a31e4867-f06d-4d03-a9a3-af1450ec03f7,aad2e7f8-da7c-4d33-ab9e-2d0e6dc26c46,2023-12-20 00:00:00,2023-12-30 00:00:00,Chodzić koniec umrzeć ryzyko wino pokój wóz.
4ff6059f-6367-4d01-83d4-6416697ef0e8,b5f7b668-52fb-489a-8383-2bb998d204d8,2023-02-06 00:00:00,2023-02-15 00:00:00,Zobaczyć zabawka metr profesor.
6e7234de-a158-4d0f-99ef-3f7f0304ead4,4623f312-d91d-40a5-8f6c-13b83b02a5b5,2023-12-08 00:00:00,2023-12-13 00:00:00,Analiza ta pokarm źle przeszkoda staw ryż kanał.
5479de4b-51ef-468a-813e-cd90b31fbdf8,558b31f9-a435-4d3d-84a2-c8410db1ac53,2023-05-24 00:00:00,2023-05-26 00:00:00,Rok ludowy centralny polityczny my gniew m.in..
5d3913a2-e4f5-4baf-ac0c-254c00700711,01ec288e-0c75-4e89-b5b3-c3efc74d8571,2023-10-03 00:00:00,2023-10-13 00:00:00,Trzymać własny w wyniku dużo.
3e818278-84d7-4314-a19c-9069643b2ba2,3345aa86-3771-49e6-bcf5-97e345894ae9,2024-03-11 00:00:00,2024-03-14 00:00:00,Wysłać Słońce jej czytać gwiazdozbiór mieszkanka prezent.
fe3eecf4-310c-43cb-a1b9-9ac42a76067b,28ed91b8-d6ba-4fcc-b4d7-970f0b27e43b,2023-03-01 00:00:00,2023-03-02 00:00:00,Przeciwny powód zając sieć.
bb9aeb87-8c5f-452c-88ef-46eacaa95043,1e71688b-6643-44a7-b5a2-5b0ca17012d1,2023-09-04 00:00:00,2023-09-12 00:00:00,Lista jeżeli pod czwartek gwiazda prezent wierzyć.
59f06d9c-5922-40d2-aba6-2a7dcaaa5242,37cd1916-58eb-4531-8322-f487773870ce,2023-02-16 00:00:00,2023-02-21 00:00:00,Żydowski łuk deska.
486d1633-56ab-4caa-bed3-bd1fcfe4be13,129faa40-5e77-4a22-8049-3daeb45b1648,2024-04-04 00:00:00,2024-04-14 00:00:00,Brak podział natychmiast pisarz robić.
ffa55086-2f33-4a4a-a482-5100ec41660e,7aec7bb0-759e-467f-a169-625d2e71670b,2024-11-28 00:00:00,2024-12-01 00:00:00,Ładny starożytny większość oddział trzeba.
af6112e9-c309-4894-8003-fa67d93cae00,a444d2de-5c15-46f5-bf92-2c25064edec0,2024-11-23 00:00:00,2024-11-27 00:00:00,Rzucić rok wynosić nóż korzyść samochodowy.
9ce539be-5472-43d0-9dd2-43c0891e763e,3bc7fcd1-d75b-4e5e-b6a6-a2ceebea66f6,2024-06-26 00:00:00,2024-06-27 00:00:00,Seksualny należeć nagle kolejny ojczyzna wakacje moralny.
a68b12b1-ee1b-4d27-a755-b5c13de1e430,6913ed64-c915-4db5-97e8-b725b55ac725,2023-11-08 00:00:00,2023-11-16 00:00:00,Nikt ząb nauczycielka krzew scena odczuwać ryba.
b022361d-7983-42a9-a5c4-347494d9a412,414e0449-0c93-49aa-af4f-f6832e295623,2023-04-22 00:00:00,2023-04-25 00:00:00,Artysta zbyt pytać dokładny grecki.
fe322ea6-fefa-4c1a-aa6a-b36786fd8427,83983dcd-f8f5-41f8-9898-1b62495aa4fc,2024-08-29 00:00:00,2024-09-06 00:00:00,Zakończenie pewny orzeł uderzyć.
858087c5-d592-4449-b227-ab8e82c3edc4,f742cf75-d620-4515-8ae7-16700f28b297,2023-03-29 00:00:00,2023-04-06 00:00:00,Prowincja przyjemny śnieg męski składać międzynarodowy pojazd małpa.
12043c7c-0566-41fa-a430-bfe3e071e955,32151f12-dff1-44b6-b3c0-9747fca1da86,2023-07-22 00:00:00,2023-07-31 00:00:00,Świeca dane letni drapieżny.
20614cf0-b78c-4d5e-9a6c-83630e1d0403,c6cb0500-1bdf-45b9-97ba-52f64e7dc6e5,2023-02-19 00:00:00,2023-02-24 00:00:00,Ulegać sto ustawa wysoki.
745c166a-5f01-42c7-a14a-5ce0e4257727,b32868a9-933e-47b7-b41b-7be212611a3a,2024-04-18 00:00:00,2024-04-28 00:00:00,Wynosić dobro katolicki pacjent okrągły chleb.
f0018150-50c1-44ab-8c17-80d0f5f88373,e13ab25c-ef97-4fc6-8aa1-2ebdacc02352,2024-07-06 00:00:00,2024-07-08 00:00:00,Mądry łóżko wrogi fotografia most zupełnie stół napisać.
cba1810f-6fd1-4821-9de5-c40d9314dfa6,dde2e30a-ac85-4e06-a717-d106e766f97c,2023-06-29 00:00:00,2023-07-09 00:00:00,Otwarty mi zakon wielki wytwarzać.
0952f6f9-f555-414f-802b-b10f49e48670,adb91284-6dd8-41c4-9c01-f3f0ca0b5674,2024-01-06 00:00:00,2024-01-15 00:00:00,Boże Narodzenie mięsień pragnąć gołąb przykład Żyd.
1a22300d-b364-447f-8350-199bf71acec0,ac255963-f93e-408c-bb63-8d66e81e31ee,2023-07-02 00:00:00,2023-07-11 00:00:00,Włochy wykonywanie mocz stopa głos.
42e30787-0527-4ab4-bdbd-cad65e202ff1,2fc31a15-8681-4358-92f1-4408fddd993c,2023-02-21 00:00:00,2023-02-26 00:00:00,Wolno składać reguła prawda sukces rachunek w formie wódka.
524800cc-fd60-4a89-9d65-4b2836addb08,f772378d-7108-46e0-9f47-99c4c47f397b,2024-06-16 00:00:00,2024-06-26 00:00:00,Własny wilk chęć otworzyć moment ostatni pokój wszyscy.
e06136a2-fea0-4af0-8051-cd8cc2d27dc2,07213d99-c5b8-4ed7-a236-723133e89018,2023-10-07 00:00:00,2023-10-11 00:00:00,Zachowywać Się polegać zazwyczaj róg ciasto wschód polityka myśleć.
41880dd5-4609-4f62-9251-09b7e9643dbb,45e9de40-4033-47b8-8338-91c114cb0345,2023-12-15 00:00:00,2023-12-17 00:00:00,Miara wyścig dotyczyć oddech zadanie partia.
06bf89b2-e42c-4119-8e0a-7f7ead937dbb,26ea2f52-6134-4c30-8f36-92d4858049b3,2023-11-18 00:00:00,2023-11-21 00:00:00,Prawdziwy filmowy rzeczywistość USA koło.
d7fedfa0-f40d-4c13-8592-81f51a4802de,da64da73-7610-4196-b910-7ee5dbd2a546,2023-10-10 00:00:00,2023-10-15 00:00:00,Korzeń ogół obrót obiad.
03858034-624f-4cb8-96a3-2077b31e300a,3ca32324-12c1-4e6d-ab64-deca5f81c7ba,2023-12-15 00:00:00,2023-12-25 00:00:00,Siostra otoczenie ser nagle diabeł październik.
2a0129d0-6758-4b5e-9375-f74e10f2174b,8dfad476-a386-4dfd-9799-93b51e7c2d20,2024-09-25 00:00:00,2024-10-02 00:00:00,Położenie wiosna zgodny lustro nazywać widoczny pałac.
7041af78-2dc6-4e6d-a343-4e17d45ef6e7,3d04a2cf-66dc-49f8-bcb1-c982ab80e690,2024-10-17 00:00:00,2024-10-21 00:00:00,Owca dziedzina połączyć róża brzeg zwolennik kierunek ciało.
a897fe7d-e58d-427a-a6a4-83ad6a3a6aec,5971b25f-7b94-47e5-9373-a524cfe1641f,2024-01-09 00:00:00,2024-01-16 00:00:00,Rozumieć potem opuścić narodowość tarcza dwa wojskowy.
df0426e7-b26b-4291-8809-86ed0d3711f6,964d15d1-b73e-4b3d-b094-e20536c3c16e,2024-08-13 00:00:00,2024-08-22 00:00:00,Chwila wyjście literatura znaczny.
9fef6a55-5299-49f4-bfbd-5b84c399bb7a,83e48a8b-7da0-4a1d-aece-66f5656a535a,2024-06-11 00:00:00,2024-06-15 00:00:00,Towarzystwo sztuka kosz umrzeć ktoś mały daleko.
4b7125ad-37b3-4cdd-bea7-af1de2aafb75,05f88cf1-713a-4267-b169-5a0c58f1009e,2023-03-19 00:00:00,2023-03-21 00:00:00,Złożyć obywatelka zaś wszyscy wczesny jeden.
3fb3331c-eec0-4b32-a130-9d8099a53354,1e60a4f6-35d3-4eb6-ae60-e18efea858dd,2023-09-06 00:00:00,2023-09-08 00:00:00,Zielony umiejętność zachowywać się kontakt kolano.
bf3317a5-9cc4-4c05-85a0-e90e4a4ca376,851b957e-e3bb-4b15-a23b-ecc881c6eb4c,2024-01-23 00:00:00,2024-01-28 00:00:00,Nagle podawać zjeść lód świadczyć pełny.
110ff504-94e6-4764-b1e0-fca4815b55b8,57275f56-c1ad-4e4f-9b05-52376780a98c,2023-07-09 00:00:00,2023-07-17 00:00:00,Powierzchnia sposób Wielka Brytania budzić albo kamień wskazywać.
67865282-671f-4417-b0e8-c9808a7e7759,f050fb6f-b8df-4ec5-a837-300570d6fb9c,2024-03-30 00:00:00,2024-04-08 00:00:00,Atmosfera doskonały akcja wydawać mistrz flaga ukraiński Australia.
ac16ea53-f033-47c0-9280-fd14fbde7ecc,e022bdee-f637-477b-8bd5-9add8c6cb3e7,2023-08-16 00:00:00,2023-08-25 00:00:00,Ośrodek list cebula długi.
6de9d1dc-f364-4df3-9115-75240d577fcd,0f928597-58c0-4ce4-b438-d5879b90d015,2023-10-22 00:00:00,2023-10-23 00:00:00,Ziemniak instrument minuta naród.
582cc551-3858-4d1e-b5c9-8c8798fb3c72,4a4ebaac-e103-4abb-a709-f2afaa380eb3,2024-04-08 00:00:00,2024-04-15 00:00:00,Klimat ocena żaden stopa kolega stać się.
4f5f1eff-453f-41e2-b0ed-669b529694ab,48beadc9-b66e-4380-ba61-92ec815ef1bc,2024-05-07 00:00:00,2024-05-14 00:00:00,Syn kartka starożytny pieniądz.
9f7e6439-833b-46aa-acc3-0cbfa51a2f99,b9b908b1-eadd-4ed9-8cde-4ab322ab2dcb,2024-07-15 00:00:00,2024-07-23 00:00:00,Holandia żółty wobec pierś lampa wolny powstanie.
0bce4156-e09a-4dd3-9b1f-9a282e35080d,7000804e-b5d8-490a-9020-357df691d54f,2024-10-17 00:00:00,2024-10-27 00:00:00,Farba przyjąć szczególny skóra pająk szpital.
a47522e2-2875-487d-8396-f54c02d0bef9,4c607576-6e07-46d3-9632-4b207c61d194,2023-10-30 00:00:00,2023-10-31 00:00:00,Warzywo lis roślina toponim wysokość.
166f22ec-67b7-438d-ba44-27167afacf91,2fd93b66-8436-4097-9a3d-ebb08d5e5749,2024-01-23 00:00:00,2024-01-28 00:00:00,Północny tradycja silnik zasada strefa wszystko.
2d042ea9-239c-4d89-9318-02ce5905ff2c,81fa8a8b-c2f9-4f1c-82a6-4ad862e8ec33,2024-08-22 00:00:00,2024-08-29 00:00:00,Wkrótce materiał kolorowy gra.
50660b02-5653-4fa1-aab8-f5cbedb65245,bac59cdc-eb14-4bf4-9538-7eacdec71e12,2023-03-13 00:00:00,2023-03-22 00:00:00,Wielkość teren całkowicie dziesięć wybierać.
e09c8824-a56e-455e-83df-8cf9080781e3,572fb29f-86bb-48b1-8835-c8fbf2eafb76,2024-04-02 00:00:00,2024-04-05 00:00:00,Futro powiat odczuwać różowy historyczny.
5cbefaf3-d371-41ff-8132-77bf0f81d50b,b608d240-d68c-4d0e-bab3-ff89400f51b8,2024-05-22 00:00:00,2024-05-27 00:00:00,Podnosić czwarty padać włos połączyć.
115ecfe9-b29f-48bd-9b08-5d26c1c706a5,e592f864-1631-4a80-9aaa-4206e3e7979a,2024-10-27 00:00:00,2024-11-04 00:00:00,Matematyka świnia drobny bić.
56e50e90-10ec-4997-8be1-d3a87be818e1,1d3a80dc-9a9e-474d-ad48-2ff0ef467ebd,2023-08-22 00:00:00,2023-08-24 00:00:00,Sam - cecha wszyscy więzienie Niemcy niebieski hotel.
0d0b9dba-2113-4329-94c5-23e2cbf03251,304ec89d-8f7a-4bcf-aab2-ea7751fda943,2024-07-16 00:00:00,2024-07-23 00:00:00,Odmiana Chiny aż krótki wódka późny.
e57f4730-0b20-47cb-a2ca-63cdda888ed6,13f7349f-6c35-44e8-a19f-b27e81b87b62,2023-07-07 00:00:00,2023-07-08 00:00:00,Mieć Na Imię ogród ciasto wśród wąż ruch.
0d2e08c8-a24c-43d5-b99f-9d57a3f64b3d,35831a18-6cad-4584-a9ff-c7ec30570ee5,2023-02-26 00:00:00,2023-03-04 00:00:00,Niemcy śmiać się szwedzki.
9fbe7230-db51-45bd-a1d7-b4ad14986ea7,97f2ce4e-0220-43b0-b770-b5f5751b5430,2024-11-16 00:00:00,2024-11-24 00:00:00,Zgodnie 10 długi bez.
d23d9793-fde7-4372-bb4f-57a2c80454a8,bb55b509-3447-453d-bcc1-be90c056e6a7,2024-06-26 00:00:00,2024-07-02 00:00:00,Uczyć dziób pszczoła sygnał wybierać dodatkowy Węgry.
1f95b001-d4bd-42ca-9cd7-dded87bec28d,7d0e49fe-86c0-40f1-ba58-a6c9dc226046,2024-10-13 00:00:00,2024-10-19 00:00:00,Sposób prezent Turcja kolejowy dźwięk obrót.
9fe66d2d-7896-49e3-9582-6e6dd6653f0f,89bf25ca-2262-44fe-804a-7ae65cbc68b4,2024-08-20 00:00:00,2024-08-28 00:00:00,Dawać rok wychodzić jakiś jeżeli.
a23413ac-157b-46d0-b43d-7e8f869f2c24,3558c467-e764-472e-b6d5-288f6026c913,2023-06-28 00:00:00,2023-07-05 00:00:00,Robotnik kolejny Dania który program rząd metal 6.
11ba845a-5b4c-443d-a1ba-bcc8493e7df8,73a1ffab-5a40-4218-9151-4c348444a763,2023-04-06 00:00:00,2023-04-11 00:00:00,Potrzeba ciepło coś dzięki.
d9d5ab84-9e53-432e-8305-8463f35d79e9,79c4df2e-3e20-4a95-9eb4-33f473c151b6,2023-10-08 00:00:00,2023-10-17 00:00:00,Miód projekt początek obecnie posługiwać się Polak.
342f14c0-d198-4625-a711-a8906fec074e,f36b5344-09ca-4f10-9cb0-8a5726a407fa,2024-05-18 00:00:00,2024-05-19 00:00:00,Nic papieros roślina ciekawy.
cd73b360-7fed-46c2-bdf5-95cb47d02702,b00c2d8f-3ddd-4e49-a35a-04ab553f92cf,2024-05-02 00:00:00,2024-05-07 00:00:00,Dziewczynka przecież plecy pora rasa.
4c853df3-041c-4e5f-9e95-a075d8d0c054,cecd148a-10d0-4f89-9555-19b3681c86aa,2024-06-03 00:00:00,2024-06-08 00:00:00,Narząd sąsiad partia ciągnąć polski m.in. jednostka zgoda.
d956f507-a9d8-4ac3-b4ce-872e05aabe93,d912000b-e63a-4e75-bf40-e6eac9533111,2023-10-19 00:00:00,2023-10-27 00:00:00,Nieprzyjemny rodowity projekt 50 kula rodzaj metalowy.
bb7d16a5-c745-43bc-aee9-9e74468f36bd,f3452a40-d799-4121-a7ef-1dfeeca96525,2024-03-30 00:00:00,2024-04-08 00:00:00,Dokładny nie starać się półwysep oś.
93a3463d-5804-4023-8ede-03956bc3080c,214e7b7b-8f3a-4657-8864-6ef709655340,2024-01-03 00:00:00,2024-01-07 00:00:00,Biuro dotyczyć czerwiec sobota natychmiast siedemdziesiąt pomidor.
14fa40b9-6721-4725-8586-0cf73bbc4e07,7d0ac9e2-1d55-4fe7-a40e-e36e814fec98,2023-06-24 00:00:00,2023-06-26 00:00:00,Urodzić Się powolny niedźwiedź literacki przestępstwo.
d26952c6-2ec8-4bab-ab42-84773bfbdf27,1e290a6d-1a84-4603-b99b-9142867661f2,2024-08-20 00:00:00,2024-08-23 00:00:00,Szeroki ich umowa położenie bliski znać.
848a9882-2849-4266-910a-ad668c402a88,b698f7a0-34ab-41cb-9b9d-92b4f8157560,2023-01-17 00:00:00,2023-01-20 00:00:00,Rezultat luty obwód mleko amharski.
ce6ac11c-6c09-4451-af52-0b6553859e65,cd851c16-ecd9-462b-b86c-00c5f7738b02,2024-05-17 00:00:00,2024-05-22 00:00:00,Tyle prowadzić pogląd wspólnota teoria leczenie pracownik róg.
1c105bf3-c4eb-4f56-8315-c414aff9caa5,b88f5672-2d9a-4168-85c9-b9cc34f98b27,2023-02-25 00:00:00,2023-02-26 00:00:00,Późny broń taniec owad większy większość strefa.
9a6685d2-b46d-466c-b864-f9a063844310,b5ed8b15-6760-4288-abc1-3873164d4f44,2023-10-07 00:00:00,2023-10-10 00:00:00,Zajęcie pójść nadmierny odmiana wykonanie medycyna.
095b3222-3ac8-4161-be63-edd8f5369bf4,ba5366f5-ef9b-42fc-a61f-471143a63b0b,2023-08-04 00:00:00,2023-08-11 00:00:00,Wolność operacja grać za pomocą.
8e4ae703-1d0d-47a2-9142-0abe5193132a,10ca9635-5cf7-4661-b4c3-b63c1d7dd31d,2024-08-18 00:00:00,2024-08-28 00:00:00,Ciecz linia pięć duży.
fe122d87-6e19-4036-97f6-11055be8c8f6,06e68901-d239-4d5a-ae1f-44a3fa9d0aa7,2023-12-09 00:00:00,2023-12-11 00:00:00,Przyczyna Austria św. składać.
62a1757f-7215-4d15-a30d-ded98235f8bd,811af3f6-8c7d-4984-89d1-9f6aad5b62fd,2023-12-05 00:00:00,2023-12-14 00:00:00,Bułgarski adres cecha.
80a52ba7-4155-4c10-8c20-8f0d653c6ce1,461c15c1-04f0-46f2-a0ac-42d4d666ed02,2023-03-10 00:00:00,2023-03-13 00:00:00,Mrówka muzyczny majuskuła płyn mecz Szwajcaria odpowiedni.
4fda7680-e4ff-41db-b56c-cc87de85ad28,670ff243-6825-4b2f-8541-05400dc8ad95,2024-02-05 00:00:00,2024-02-08 00:00:00,Produkt fakt herbata kontakt jeżeli przyszły stać się.
0a75186f-97c6-4910-9c06-9ca6e08e2699,0f537cd9-f3d2-45fe-b900-3b976132e0be,2023-03-30 00:00:00,2023-04-06 00:00:00,Stowarzyszenie panować jądro obecny temu stół.
9fc247bc-767e-4375-9676-518997d84e29,13502d94-f966-4b53-af21-ae7cf2beb9c8,2024-06-22 00:00:00,2024-06-27 00:00:00,Słowacki pochodzić jego martwy.
0fdc6d8c-a460-485f-b42f-7b166a6ff7a8,43701857-eb61-496a-9260-9fe89bd9023e,2023-10-13 00:00:00,2023-10-16 00:00:00,Pełnić piętro dość róg.
5eeed5d7-5cb2-4364-aa92-9c112becf320,336819ca-4d70-4a71-b508-8864f5150653,2023-04-12 00:00:00,2023-04-16 00:00:00,Dziś cały produkt całkowicie bar.
7f1cd7de-f894-4587-b6ed-7daa8f9ffcf4,bcc7ef9e-6b17-4783-adc4-40d3910fa43a,2023-06-08 00:00:00,2023-06-16 00:00:00,Maj kino wnętrze utwór Francja włosy.
fbb7efaa-5d07-4574-96ec-0c52ec470c69,8791692a-1209-43b5-ac3f-c50841411001,2024-10-21 00:00:00,2024-10-22 00:00:00,Styl Jezus poduszka krowa.
56a4b72e-a673-493d-80ec-cd0433763011,705b967b-8ee1-42e6-b2e0-84e0fa8f7fc8,2024-07-20 00:00:00,2024-07-28 00:00:00,List koncert pole przyrząd patrzeć.
e00ad1a8-99f3-424a-8eb0-165bbbac225b,a3df584a-18f8-40ab-a51b-d5bac0c4b5ba,2023-06-05 00:00:00,2023-06-08 00:00:00,Pieśń tytuł zjawisko księżyc zwłaszcza.
2557ba36-613f-4407-a41d-aa6753f05f08,c3f9729d-6e86-4037-8491-609f201f239a,2023-10-08 00:00:00,2023-10-14 00:00:00,Informacja płaszcz upadek myśleć kończyć niechęć dziewczynka.
c7a1c1c0-755d-4643-8605-1b27cb2c1ac5,c364377a-fc2d-423e-81ed-6dfa8176ede2,2023-03-13 00:00:00,2023-03-23 00:00:00,Australia sobie pełen przyjemny.
72e10bb0-2f1b-4dbf-90ec-b9d2acafa95b,4692b3b2-886b-4486-8b78-ecffb8e370c9,2024-02-21 00:00:00,2024-02-28 00:00:00,Australia okrągły tak fotografia.
c6441b4a-5c2a-4da1-b79f-a70458f95062,430c305a-d566-481d-b2b7-ec24a620b1af,2023-04-03 00:00:00,2023-04-09 00:00:00,Ciąża źródło głupi numer wieś przedstawiać.
66edb5e5-af43-491f-8ae8-d65dacbaa237,62a49721-68e9-476d-80ec-4f60189a76d7,2024-09-28 00:00:00,2024-09-29 00:00:00,Łódź odpowiedni ciemny zapach godny.
52b53e1c-6f5c-4d25-9768-0e794a124121,36fe7e2c-4be4-41bc-bb71-311b3dfd605c,2024-02-19 00:00:00,2024-02-29 00:00:00,Marka księga czekolada Hiszpania.
1a3a9fda-72cc-4103-8683-5944368b3920,40409b6a-aba8-442c-979b-4e2fcf0eb144,2023-03-16 00:00:00,2023-03-19 00:00:00,Relacja ryzyko duński własny.
5e9be6aa-a1f1-47f2-8595-c8c836df8b5f,f3dc1321-24ab-4521-b1e2-55a3d4f79e26,2024-01-30 00:00:00,2024-02-09 00:00:00,Grudzień starożytny nikt.
26abee68-0237-47ea-80d1-558acf5dd5cd,1194f6a7-15f9-48d7-910d-239333c463c4,2023-08-17 00:00:00,2023-08-18 00:00:00,Dziwny mi obwód uderzyć kierowca rok wychodzić.
63ee2d8a-bf68-4037-bf31-8b1ada1ec22e,29cdd593-42a9-474d-adea-f6717b67f937,2023-12-30 00:00:00,2024-01-05 00:00:00,Choć wyjść materiał pałac.
e561acc6-ccce-4aa1-80d2-6b8901483255,37464914-0a80-49eb-a5d6-368ba5cf30f4,2024-11-12 00:00:00,2024-11-14 00:00:00,Tańczyć atak czasem radiowy strumień proces.
047b8418-7812-4609-b4a5-fb15e60a6936,c5b8dbd7-3446-44a8-8e02-ae9a782ec17e,2023-01-12 00:00:00,2023-01-21 00:00:00,Cena zdanie pod.
ba7ac5c0-be58-4406-a625-b3a0d441a5e2,e70d89f4-9b13-4b37-a5f2-e60c3b75d29f,2024-03-19 00:00:00,2024-03-29 00:00:00,Pustynia nawet obowiązywać wąż otoczenie strona mieszkać zaś.
f11986d5-36c6-472f-b86e-835821ae7241,225a4aa5-b8be-4044-ad71-2e9b336e6565,2023-02-02 00:00:00,2023-02-07 00:00:00,Hasło lis wojenny małżeństwo.
5d88b2b4-14e5-48e2-9332-3c29f18350e4,b5e49d83-ab23-468e-bbd6-69243c3767ce,2024-04-22 00:00:00,2024-04-25 00:00:00,Wina człowiek zgoda związać marka zimno trwały połowa.
6ede570e-eed1-468e-bf6f-3a7bd1a4d64d,c4668e9a-cabe-4f6d-8e44-fdb8c983f2a7,2024-05-28 00:00:00,2024-06-01 00:00:00,Dom oczywiście przed statek.
284d7398-1e9c-439f-893c-34f6a730cd0c,0faecfa9-9312-44dc-a94c-1ef4db0c9e96,2023-05-15 00:00:00,2023-05-16 00:00:00,Czyli do chrześcijaństwo ustawa potrzeba moneta przyjemny doskonały.
8e910b7f-d1c4-4d3e-a6c6-4954b27b2b2e,35ab1e07-9eb2-41c7-9831-7e46112b2832,2023-06-19 00:00:00,2023-06-26 00:00:00,Sportowy charakterystyczny centralny rok istota.
5570f82d-0fd9-4c35-b9ba-47e26bae863b,d29d0b98-5bd5-4f68-94f0-6ab42d739d0e,2024-05-11 00:00:00,2024-05-21 00:00:00,Morze Śródziemne Jezus miły wygrać stado rolnik sędzia.
d752e6ff-bd79-4f82-8bd5-75c59359c622,a91a87d4-4c83-4eaa-b168-61c015eff0e0,2023-04-21 00:00:00,2023-04-25 00:00:00,Wszystkie rak członek grudzień siostra.
cacce952-72ed-4466-936c-e6cdfed73cdd,9179790b-670b-446b-be0f-8eebb07ae33a,2024-10-24 00:00:00,2024-10-29 00:00:00,Prostytutka mleko wielki pas kolega tu wiadomość.
2c1991ac-ddbe-4a8d-899b-76eb4eb7fb79,4a283b24-0dd6-4610-8592-88481d502359,2023-02-12 00:00:00,2023-02-15 00:00:00,Suma muzyka lewy.
99aaf92d-f284-483f-981a-82ec1ac9e766,35d44bfc-c8fc-4690-9e19-cf6248f41a9c,2023-04-21 00:00:00,2023-04-30 00:00:00,Samolot dziewczynka odczuwać kurs a przyjmować płacić.
11340a92-713b-4289-b91a-4c10c6be32d4,1fae27a0-19dc-481f-a672-7ff29073816b,2024-04-14 00:00:00,2024-04-19 00:00:00,Zjeść 10 plemię wieczór grecki list program.
3197bd00-ccd1-4314-bdae-016f90fa3628,9f429769-43b9-42a1-afb6-f761dde03160,2024-10-22 00:00:00,2024-10-23 00:00:00,Ósmy urodzić przeszłość przedmiot.
82ff8993-f348-4d89-a169-7240463b2a78,cc59e010-cd7b-4840-8ecd-8465b471687e,2023-05-26 00:00:00,2023-05-28 00:00:00,Dość Australia wyrób butelka dziadek mebel babcia.
223029f4-f779-4ce3-9a55-79cc5cce2275,574b0c32-8aa7-4fdc-b7be-74b3979bf7cc,2024-03-19 00:00:00,2024-03-21 00:00:00,Uczeń okropny Izrael impreza.
bc50db99-4a3f-4a78-99a4-937bdc6714c9,8f0c664c-1606-4979-9874-1353363fba70,2023-07-04 00:00:00,2023-07-09 00:00:00,Wybór węgiel białoruski narząd olej Żyd suma.
24073939-3ba5-4c42-9b3c-84e750af8fd4,393385b3-0ecc-4baa-91d6-fda41376b104,2023-10-30 00:00:00,2023-11-04 00:00:00,Pomysł Australia otwierać południe rodzinny godny mleko po.
e8c3aaf2-6409-40c1-9c69-bd0eb8af8e7d,83b5978b-635e-4286-9f06-761bb7a700de,2024-09-27 00:00:00,2024-10-07 00:00:00,Obwód czapka śniadanie plan.
90faf31c-33c6-4684-814a-b9c574bb0cd0,7a849e3d-ee05-4cc5-9a6c-3f5e94e07106,2023-08-22 00:00:00,2023-08-23 00:00:00,Tam pani przyjęcie wiadomość spaść obecnie.
b74a1d42-356c-4699-9a6e-cc0248ed08cc,9675bd25-f575-47ff-837a-dcf014c4b479,2024-12-28 00:00:00,2025-01-05 00:00:00,Blisko umiejętność obrót na przykład występować cecha.
ab5d6b85-ce41-4656-939a-d4082298b041,c1385d18-65a2-4a47-8b06-8990f2b5cfd2,2023-04-03 00:00:00,2023-04-06 00:00:00,Zielony otaczać budowa zakończenie dokument trzydziesty zwykle.
9567f000-c0ea-44fc-a7e9-5e27b85546b2,eb436701-09fb-41be-929f-aa86cbbe37ab,2023-08-08 00:00:00,2023-08-15 00:00:00,Otworzyć chyba lub ból przeznaczyć.
c09a7eda-5dca-44dd-959f-438363a7db7b,78e8e55a-3793-4044-90e7-74d27e917295,2024-05-04 00:00:00,2024-05-07 00:00:00,Wytwarzać klient no brać księżyc nasienie spotkanie.
691bb2e9-9342-4b4b-ad95-eeffb06bfb53,e6009417-1862-4996-b354-c478b70631d5,2023-09-05 00:00:00,2023-09-08 00:00:00,Walka pragnienie szwedzki stopa Niemiec bić powolny.
c6f9388b-4d6b-481c-8a3e-01916acc9f32,10c40782-d825-4f46-bad8-fb82c9d5e40e,2024-02-02 00:00:00,2024-02-05 00:00:00,Ciepły taki osiągnąć kuchnia królowa.
827f913b-d0bb-4c85-a090-26addcf11f81,a0a804ca-2b37-45f2-9f6d-6252ea15156d,2023-04-28 00:00:00,2023-05-07 00:00:00,Odbywać Się ciecz różowy bądź 3.
22ad7ad1-6b8c-4c29-bc91-937c2b849f86,d2cbe11d-f648-4737-af98-34c79615e49d,2024-12-24 00:00:00,2024-12-27 00:00:00,Tarcza wynosić muzyczny wywołać życie ulegać słowacki.
3a858da3-3680-4473-b770-cfc41e8c4313,006ea334-c90b-4c40-b4d5-449eb182399f,2023-02-28 00:00:00,2023-03-06 00:00:00,W pełen każdy owoc zamieszkiwać złapać Kościół.
4209668b-db73-43f8-b7a7-67d15fcaa240,79f685f1-3239-4d18-9cd7-6529dc18797b,2023-03-18 00:00:00,2023-03-24 00:00:00,Restauracja wydarzenie jabłko bardzo.
04d43dd8-04ec-44b3-9f50-fbc6de06938e,37e02f6a-d95f-40c2-9804-24705ca70cf0,2024-10-01 00:00:00,2024-10-03 00:00:00,Angielski ściana jeździć jajo często.
41f443c4-4302-45de-802a-06734c0f5e9f,902ae762-ff44-4fd0-96f3-832b9f7fc05e,2023-08-31 00:00:00,2023-09-06 00:00:00,Zarówno działanie powstać jądro.
9787aba7-e19c-437e-bb19-1cb92cd8f312,dfc18fc5-da37-467f-868d-05946836fc4d,2023-06-15 00:00:00,2023-06-24 00:00:00,Tablica ze otrzymywać religia ogród dziewczynka góra.
3159e1b2-4371-400b-908e-4703e3e78058,8a80b0d4-08f6-462e-bc26-52107199dcac,2023-11-10 00:00:00,2023-11-18 00:00:00,Coś trudność tkanina na przykład.
198beae2-8da9-4e99-a197-cdcc83151740,a1200c8f-3c56-465a-8148-c8031723230f,2023-05-11 00:00:00,2023-05-16 00:00:00,Zakład piwo 9.
da472962-f566-4aff-813f-784a647d9291,03dbea3e-f72f-46e3-af83-26091d6e1921,2023-02-21 00:00:00,2023-02-22 00:00:00,Żydowski prawo bilet gospodarka pojęcie bohater.
2d867de5-6bd9-4fe9-a044-20f213231099,4673d6bc-0f6d-41c0-8f74-f2b3edfc8170,2023-06-22 00:00:00,2023-06-28 00:00:00,Dziewięć brać poważny nauczycielka rzecz przedsiębiorstwo.
932f5d73-1c2d-4494-9a86-5c9096c6d07c,684d4770-b76b-42b9-b581-dbd6ff9b0513,2023-04-27 00:00:00,2023-05-07 00:00:00,Zwykle godność okres dodawać norma członek.
5a8ad088-6015-4d08-aa24-a249546717d3,8448094d-9507-43d2-aef7-e21909586669,2023-09-06 00:00:00,2023-09-08 00:00:00,Mrówka środek chłopak naprawdę żona kiedyś opieka.
12e2d0a2-959a-4dcc-b369-22ceabdee590,99238503-1720-40ce-8d56-a040e83807d6,2024-06-04 00:00:00,2024-06-14 00:00:00,Przebywać ziemniak kolacja pozostawać podstawa nowy.
3eacf121-d081-4a62-b6d6-d13ad71d3c30,77a02a16-1d9f-4f3b-b812-926a2976c09a,2024-04-14 00:00:00,2024-04-16 00:00:00,Posiłek zanim głównie polityczny jedzenie statek majątek.
280015b3-eeac-4472-af7e-e67cd8b1388d,e57a0b89-0f78-4b1a-97d1-56e83dd5c9e1,2024-01-11 00:00:00,2024-01-18 00:00:00,Kostka czwartek średni piękny.
00e302bf-15ef-4032-bfaa-441ec76f5a7f,5d48d033-7cdf-4ac0-a2fc-8a036c6ae166,2024-04-30 00:00:00,2024-05-08 00:00:00,Miły wykorzystywać wrażenie biuro wiersz.
5580dc95-786a-407f-a078-236252a97691,3f4fe456-a8cc-48c2-ae9d-695b5a5839f2,2023-06-17 00:00:00,2023-06-24 00:00:00,Żydowski muzeum urzędnik prywatny poza Warszawa muzyczny gołąb.
b3b32261-661e-4655-8dc2-286b52be62a0,543ca6d9-50b5-4e6e-8c84-64af5fdf0cb4,2024-02-13 00:00:00,2024-02-17 00:00:00,Św. sobota długość szary zamiast artykuł podczas.
0727e789-dd04-4ff6-b4a6-32518adb8867,a84cbdb3-311b-46ec-91d4-6c3831b83a75,2024-03-21 00:00:00,2024-03-27 00:00:00,Grupa Warszawa moment.
3809dc0e-fb56-4a42-8538-8d541b8fbbc4,c677c380-510e-4bc9-9b71-04329deb3572,2023-03-11 00:00:00,2023-03-15 00:00:00,Górski działalność bułgarski samolot księżyc ludność biedny.
da47b19d-e615-4093-afc1-d9e9aa56066f,5fa42a65-b05f-489a-a92f-b2129b27d88c,2023-10-08 00:00:00,2023-10-11 00:00:00,Z Powodu wystawa miara pokazywać dać wątpliwość.
41b1ae30-ca3f-4529-9c81-d190f7e7c224,5cc461d2-b0ea-4dbc-b70e-8393fe828840,2023-04-20 00:00:00,2023-04-21 00:00:00,Lud należeć czwarty żywność.
7c77f9bd-a0a4-442f-b326-a10910522c3f,be7c2fb0-226f-4699-9b07-0a044a398e3c,2023-05-30 00:00:00,2023-05-31 00:00:00,Miecz Kraków Wielka Brytania niezwykły.
90232ecb-9dbd-4843-9b86-4d65903588fe,341a4323-1724-4109-ba59-d62a10f18d2a,2024-12-30 00:00:00,2025-01-02 00:00:00,Cel kraj kwiat rosnąć hotel.
d245eb5a-dd86-4151-acd6-96eef03cc559,f751dd6e-cf14-47c2-adcf-371dab7f5aa4,2024-07-30 00:00:00,2024-08-07 00:00:00,Dlatego rodzaj tytuł doprowadzić klimat przynosić inny.
eeb09f7f-2b8f-4267-9c94-0d8d21c23b57,58c8a6c2-990f-423c-8e0d-168a21422477,2024-06-18 00:00:00,2024-06-28 00:00:00,Obszar stolica trwały dyrektor obserwować szanowny.
dc8b4311-4aa2-4064-8a90-44d12451e12a,efed1764-b440-47e4-a9ca-ef9051a61f3e,2023-07-01 00:00:00,2023-07-07 00:00:00,Kult komputerowy wrzesień obrona mówić papieros.
e5a23345-e4f9-43b5-89f3-a802c859bfa3,f2e2c770-17d6-471a-8f5f-9ee0be015ba0,2024-04-04 00:00:00,2024-04-14 00:00:00,Uczyć lot śmiać się chłopiec.
87f54f95-daf5-4d32-ab81-c657e4d6933b,ae1007a8-9a76-4d6e-994d-78bdf6f33823,2023-08-20 00:00:00,2023-08-24 00:00:00,Czy polityka gdzie słownik świeży pamięć.
39f9f7a2-b827-4f35-9be5-719fe9d11042,6b570114-2596-4b3a-a6ec-f854afeaab25,2024-07-11 00:00:00,2024-07-17 00:00:00,Chyba połączenie alkohol samica mi potrawa zacząć.
